description,name,operation,price,type
"Detalles de Ofibodega y fabrica en Renta Z. 8 San Miguel Petapa      En Renta Antigua fabrica lista para ocuparse, en zona 8 de San Miguel Petapa, área totalmente industrial,  con varios accesos, carretera privada VAS, amplias calles para transporte pesado, cercano a bancos, comercios, la propiedad cuenta con: Primer Área de Oficinas:  **espacio de 870 mts2  12 oficinas, entre ellas un espacio abierto de 120mts2 para instalar 16 posiciones de trabajo, sala de reuniones, area de comedor, cuarto de servidores. (oficinas cuentan con mobiliario) 2 baños 5 parqueos  Garita de seguridad Segunda Área de oficinas:  Espacio de 400mts2  14 oficinas entre ellas, 2 salas de reuniones, espacio abierto para 16 posiciones de trabajo, área de servidores, área de comedor. (oficinas cuentan con mobiliario) 7 baños, 1 en oficina dentro de oficina y 6 en área compartida.  5 parqueos  Cuenta con 11 bodegas de almacenamiento o producción, algunas con opción a unir en total son 3,490mtros solo de bodegas y cuentan con las siguientes medidas: Bodega 1 de   24 mts2  Bodega 2 de 126 mts2 Bodega 3 de 225 mts2  Bodega 4 de 900 mts2  Bodega 5 de 400 mts2  Bodega 6 de 550 mts2  Bodega 7 de    87 mts2  Bodega 8 de 525 mts2  Bodega 9 de 191 mts2  Bodega 10 de 115 mts2  Bodega 11 de 347 mts2  * 2 Baterías de 10 baños, 8 duchas y lockers para personal * 2 Baterías de baños en oficinas  * 10 estacionamientos para visitas * área de maniobra  * Disponibilidad de abastecimiento eléctrico para procesos de producción industrial * Sistema contra incendios, con pozo de 750,000 Lts de agua  * Pozo propio con capacidad de 8000 Gls * Sistema para purificación y reciclado de agua  * Mobiliario de oficinas  Renta + impuestos",Ofibodega y fabrica en Renta Z. 8 San Miguel Petapa   ,Renta,"USD13,700",Bodegas/Naves industriales
"Detalles de VENTA DE LINDO TERRENO EN ALTOS DE MONTEBELLO   Terreno Plano en venta en Altos de Montebello km 9.5 Carretera a El Salvador en la Ciudad dde Guatemala, a pocos minutos del teebol de Vista Hermosa. Con mucha vegetación alrededor terreno con cierta inclinación. El terreno es de 1066 VR2 se encuentra dentro de Condominio.",VENTA DE LINDO TERRENO EN ALTOS DE MONTEBELLO,Venta,"Q1,300,000",Terrenos
"Detalles de Apartamento en renta en zona 13 al final las Américas   Apartamento en edificio clásico en zona 13 al final de la Avenida Las Américas,  rodeado de zona arbolada con accesos sobre las Américas, , Avenida Hincapié, en los alrededores se ubican ciclovías, centros comerciales, tiendas de conveniencia, bancos del sistema, restaurantes, entre otros- El edificio de 13 niveles de construcción de apartamentos de ambientes amplios, con vistas espectaculares, muy familiar y céntrico,  de 2 habitaciones, 1 baño sala, comedor, cocina, 1 parqueo, habitación de servicio con baño completo, el apartamento cuenta con calentador de agua, un balcón con vista espectacular a la Avenida Las Américas, el aeropuerto  El edificio cuenta con gimnasio Valor de renta incluye mantenimiento más impuestos, NO SE PERMITEN MASCOTAS",Apartamento en renta en zona 13 al final las Américas,Renta,USD700,Apartamentos
"Detalles de Alquilo Apartamento en zona 10 muy céntrico   Rento Apartamento en zona 10 a dos cuadras de La Pradera y Dollar City Este apartamento cuenta con  2 habitaciones, 1 baño, 1 parqueo.  Cocina con gabinetes. Excelentes accesos a áreas comerciales, gimnasios y transporte público (transurbano) Esta ubicado en primer nivel de casa.",Alquilo Apartamento en zona 10 muy céntrico,Renta,"Q4,000",Apartamentos
"Detalles de Oficina Amueblada en Renta zona 9   La oficina se encuentra en area Comercial, con ubicación estratégica, rodeada de Edificios Empresariales, fácil acceso,  Servicios varios como bancos, restaurantes, parqueos etc.  Acceso desde el centro de la ciudad, entre 7ma avenida y Avenida Reforma, zona 15, zona 9, zona 10. La oficina en alquiler se encuentra tabicada y se alquila con mobiliario.  Cuenta con Sala de Espera, recepción, cocina, baño, sala de reuniones, área de trabajo, y dos oficinas principales.    La oficina se encuentra amueblada completamente,  tiene separaciones de tabla yeso y en su mayoría paredes de vidrio.  Las areas de trabajo. se encuentran tabicadas y con separaciones de vidrios.  Con muchos muebles y terminaciones de madera. Parqueo es de Q10 cada media hora.   Opción a alquilar parqueos por mes, siempre y cuando haya disponibilidad. El mantenimiento incluye la seguridad, extraccion de basura y servicio de Agua.  La cuota de mantenimiento esta incluida en la renta.  La oficina cuenta con 1 parqueo propio, si hay necesidad de alquilar mas parqueos,",Oficina Amueblada en Renta zona 9,Renta,"USD1,500",Oficinas
"Detalles de Oficinas en alquiler en Europlaza   Oficinas amuebladas en alquiler en Europlaza zona 14. Las oficinas cuenta con, recepción, sala de reuniones, area cafetería, baños. El edificio cuenta con 4 torres de 19 niveles cada una, 6 ascensores por torre, parqueos de visitas, area comercial. La renta incluye: uso cafeteria, recepcion y entrega documentos, sala de reuniones, cafe, limpieza, agua, luz, internet",Oficinas en alquiler en Europlaza,Renta,USD522,Oficinas
"Detalles de Lujoso Apartamento en Venta Villa Risho Zona 14   Lujoso y amplio apartamento en venta en Zona 14 Ciudad de Guatemala En un entorno lindo con parques, área comercial, ciclovías, áreas para deportes, supermercados y el área mas Exclusiva de la ciudad. El edificio cuenta con motor lobby, lobby, área niños, área verde, parqueo de visitas, 2 ascensores, gimnasio, salón social de eventos, piscina climatizada, área solárium. Apartamento con 300mts + parqueos. Vestíbulo, sala principal, comedor, amplios balcones, cocina independiente equipada y con desayunador, área de lavandería y servicio con baño completo, sala familiar y área para estudio, amplia habitación principal con balcón, baño, walkin closet y Jettina, 2 habitaciones secundarias con baño completo cada una y closet. *Renta incluye mantenimiento",Lujoso Apartamento en Venta Villa Risho Zona 14,Venta,"USD525,000",Apartamentos
"Detalles de VENTA DE CASA EN CONDOMINIO DE 4 HABITACIONES EN ZONA 2   Venta de casa en condominio de 3 niveles y 4 habitaciones en zona 2. 1er Nivel: Sala/comedor Cocina Garage para 2 vehículos 2o. Nivel: Habitación Máster con baño completo y tina, con closets  2 Habitaciones secundarias con clóset que comparten baño 3er. Nivel:  Sótano  Estudio  Sala Familiar 1 Habitación con closet 1 Baño completo  Patio trasero con pila y conexiones para  lavadora y secadora. Gradas independientes para subir al 1er. Nivel  Valores Agregados:  -Lámparas LED nuevas en todas las áreas. -Switchs nuevos en toda la casa -Se realizó cambio de  piso en toda la casa. - Se entrega con todas las galerías y cortinas actualmente instaladas, así como closets y repisas.  -Se cambiaron todas las griferías de los 3 baños, así como cambio de azulejos. -Se le ha aplicado revestimiento Sika 5,000 (impermeabilizante) y  que  aisla el calor en techos y carport. Mantenimiento Incluye: Servicio de Agua potable, seguridad 24 horas, extracción de basura, mantenimiento de  áreas verdes.  Se efectuó cambio total del revestimiento exterior (3 niveles)",VENTA DE CASA EN CONDOMINIO DE 4 HABITACIONES EN ZONA 2,Venta,"Q1,550,000",Casas
"Detalles de SE VENDE TERRENO EN EL ENCINAL TRONCO 16   Exclusivo terreno residencial en venta,  en esquina   El Encinal tronco 16, es un lote tipo campestre, de topografía irregular, aprovechable el 100%, poco inclinado. El terreno mide 48 metros de frente sobre calle y 38 metros de largo, y se reduce a 44.17 en lo ancho de atrás,. Si le gusta la naturaleza, y vivir alejado de ruidos y contaminación, este el lugar ideal que usted necesita, accesible con calles asfaltadas, doble garita de seguridad, antes de llegar a su residencia tiene el privilegio de pasar frente a plaza de conveniencia, donde encuentra supermercado, bancos, restaurantes, panadería, lavandería, etc.  precio más impuestos.",SE VENDE TERRENO EN EL ENCINAL TRONCO 16,Venta,"Q1,250,000",Terrenos
"Detalles de GRANJA EN RENTA PUERTO DE SAN JOSE ESCUINTLA   Puerto de San José, km 101.8, Escuintla.  SE ALQUILA  Amplia granja plana en alquiler con casa campestre, arboles frutales, es una manzana y media en total de terreno, puede rentar con la casa o sin la casa y ocupar solo terreno,. El terreno consta de: Una casa patronal de 2 habitaciones con a/c, un baño, sala, comedor, cocina, y desayunador, y pozo con bomba de agua. Un rancho de 7 x 7 con churrasquera, lavatrastos. Una casa de guardián con una habitación, sala, comedor, un baño, cocina, pozo y bomba de agua. La granja en general ofrece lo siguiente:  03 árboles de carambola, 150 matas de plátano, 16 árboles de mango tomy, 07 árboles de limón, 07 árboles mango pashte, 09 árboles de aguacate, 41 árboles de coco, 02 árboles de caimito.",GRANJA EN RENTA PUERTO DE SAN JOSE ESCUINTLA,Renta,"Q12,000",Casas
"Detalles de Terreno en Venta en Granja Buenos Aires   Terreno en Venta en Granja Buenos Aires en el kilómetro 22 de la Carretera a El Salvador en Ciudad de Guatemala El terreno se encuentrr cerca de la Ciudad de Dios, Decocity, Plaza Madero entre otros. Cuenta con 753 Varas totales",Terreno en Venta en Granja Buenos Aires,Venta,"USD29,000",Terrenos
"Detalles de Terreno en Venta en Alta Vista Country Club   Terreno en Venta en Alta Vista Country Club en San José Pinula Ciudad de Guatemala, un lugar muy buscado con un entorno increible y a pocos minutos del area de Carretera a El Salvador El terreno cuenta con 15 metros de frente por 44 metros de fondo para un total de 966 varas totales, ideal para una hermosa casa familiar que desea vivir alejada del bullicio pero cerca de todo.",Terreno en Venta en Alta Vista Country Club,Venta,"USD35,000",Terrenos
"Detalles de Terreno en Venta Montebello Km29 El Carretera Salvador   Terreno en Venta Montebello Km29 El Carretera Salvador en Ciudad de Guatemala, en un entorno unico y con ambiente natural. El terreno en venta cuenta con 16 metros de frente por 85 metros de fondo para un total de 1750 varas totales",Terreno en Venta Montebello Km29 El Carretera Salvador,Venta,"USD45,000",Terrenos
"Detalles de Alquilo apartamento en zona 10 Ciudad Guatemala   Edificio ubicado en el sector mas exclusivo de zona 10, con amenidades espectaculares.  Apartamento en Renta de  3 habitaciones,  dos de estas con acceso a balcón, 2.5 baños(habitación principal cuenta con tina) 2. Salas familiares, piso de madera entodas las habitaciones, cuenta con dos accesos principal y de servicio. 2.parqueos  Cocina y lavandería equipadas con electrodomésticos  (refrigeradora,horno, lavadora de platos, estufa y torre de lavadora y secadora.  Amenidades: Gym, salón social, juegos paraniños, parqueos para visitas  El precio de la renta incluye mantenimiento.",Alquilo apartamento en zona 10 Ciudad Guatemala,Renta,"USD1,700",Apartamentos
"Detalles de Local en Renta en Zona 12 Madero Express   Alquilo local en la Zona 12 de la Ciudad Guatemala, Calzada Atanasio Tzul cuenta con un área de 332.85 m2 de construcción con media baño ideal para farmacias, entidades bancarias, áreas de servicio al cliente o agencias de viajes.  La plaza comercial cuenta con amplio parqueo de visitas, seguridad las 24 hrs. tiendas de conveniencia, restaurantes de comida rápida, gimnasios.",Local en Renta en Zona 12 Madero Express,Renta,"USD3,828",Locales comerciales
"Detalles de Terreno Comercial Carretera principal a Esquipulas   CityMax vende  Terreno ubicado en km 180 CA-10 Chiquimula,excelente ubicación sobre calle principal a Esquipulas. Ideal para construcciónde bodegas comerciales, hotel y restaurantes ecológicos por ruta de altoturismo. Cuenta con siembra de limón persa y limón criollo, pozopropio con abundante agua,  acceso a río Shutaque. Este terreno cuenta con163mts de frente y un  total de 9,654.84 mts2 (1.381753 manzanas) Cuenta con casa de 12 metros de frente y 6 metros de fondo,cuenta con 3 habitaciones,  todas conbaño privado, área de cocina comedor y corredor.",Terreno Comercial Carretera principal a Esquipulas,Venta,"Q1,700,000",Terrenos
"Detalles de Apartamento en venta y renta en zona 2, Ciudad Nueva   Cómodo    Apartamento en Venta y Renta en la ZONA 2 de Guatemala , cercano a centros comerciales y parques de la ciudad, ubicado en un edificio Moderno rodeado de un clima familiar  con zonas verdes céntrico a pocos metros de la calle Martí.  El  apartamento en venta cuenta con 2 habitaciones, 2 baños, sala, comedor, balcón y jardinera , 2 parqueos,  62.36 mt2 de apartamento + 25mt2 de parqueo = 89.36mt2,  el edificio cuenta con Piscina, pérgolas, gimnasio, salón social, área de lavandería, juegos de niños,  WIFI, Sala de Reuniones, 3 elevadores,  entre otras amenidades , ubicado en el sector de Ciudad Nueva zona 2 Valor de venta más impuestos, renta incluye mantenimiento, no incluye línea blanca","Apartamento en venta y renta en zona 2, Ciudad Nueva",Venta y Renta,"Q850,000",Apartamentos
"Detalles de Local comercial a Estrenar en Zona 10 en Renta   Local comercisl en Renta en la Zona 10 con 262.44 m2 de construcción, incluye una bodega de 9 m2 y 5 parqueos  para vehículos,  El Edificio cuenta con seguridad las 24 hrs. ubicado en una zona céntrica de la zona 10, cercano a tiendas de conveniencia, gasolineras, centros comerciales,   PRECIO DE RENTA MAS IMPUES E INCLUYE MANTENIMIENTO",Local comercial a Estrenar en Zona 10 en Renta,Renta,"USD3,850",Locales comerciales
"Detalles de Rento Ofibodega en ntrada San José Pinula 391.95mts2   Rento Ofibodega Para estrenar en San Jose Pinula Km 18, Excelente Ubicación en Carretera a El Salvador  la Ofibodega se encuentra dentro de complejo con seguridad las 24 horas Parqueo propio frente a la bodega Baño dentro de la bodega  parqueo de visitas Limpieza y mantenimiento de áreascomunes Acceso electrónico en garita Cámaras de seguridad La bodega cuenta con 327.69 mts2 de Bodega + 64.26mts2 de Mezzanine Total de Bodega 391.95mts2 Renta incluye mantenimiento mas IVA",Rento Ofibodega en ntrada San José Pinula 391.95mts2,Renta,"USD2,155",Bodegas/Naves industriales
Detalles de En Alquiler Bodega 343.80mts2 entrada San Jose Pinula    Rento Ofibodega de 343.80mts2 dentro de complejo totalmente nuevo Cuenta con una ubicación privilegiada en el km 18 carretera a San Jose Pinula  El complejo cuenta con: Parqueo propio frente a la bodega Baño dentro de la bodega parqueo de visitas Limpieza y mantenimiento de áreas comunes Acceso electrónico en garita Cámaras de seguridad La Ofibodega se distribuye: Bodega 294.67mts2 Mezzanine 49.13 Total metraje de la Ofibodega 343.80mts2 Renta incluye mantenimiento mas IVA,En Alquiler Bodega 343.80mts2 entrada San Jose Pinula ,Renta,"USD1,917",Bodegas/Naves industriales
"Detalles de Alquilo Ofibodega de 366.45mts2 en San Jose Pinula km18   Alquilo ofibodega dentro de complejo en el km 18 carretera a San Jose Pinula  se distribuye de la manera siguiente: Bodega 301.10 mts2 Mezzanine 65.35 TOTAL DE LA OFIBODEGA 366.45MTS2 Complejo nuevo cuenta con seguridad 24 horas, parqueo de visitas, circuito de camaras Excelente ubicacion y facilidad de accesos  mantenimiento incluye: Agua hasta 10mts3 si se excede Q100x mts2 Extracción de Basura (No incluye material toxico o bioinfeccioso) Control del acceso peatonal y vehicular, limpieza y ornato de áreas comunes, comunicación inalámbrica con garita e iluminación exterior 24 horas los 365 días al año",Alquilo Ofibodega de 366.45mts2 en San Jose Pinula km18,Renta,"USD2,029",Bodegas/Naves industriales
Detalles de En renta Ofibodega dentro de complejo  San Jose Pinula   Ofibodega en Alquiler en complejo industrial ubicado en carretera a San Jose Pinula  Distribución: Bodega 269.39 mts2 Mezzanine 62.81mts2 TOTAL OFIBODEGA 332.20MTS2 Renta incluye Mantenimiento mas IVA,En renta Ofibodega dentro de complejo  San Jose Pinula,Renta,"USD1,859",Bodegas/Naves industriales
"Detalles de Clínica Medica en Alquiler a ESTRENAR Renovati Zona 10   Clínica Medica en Alquiler en la Zona 10 a ESTRENAR, Edificio Renovati, cuenta con un área de 52 m2 + un parqueo VIP + 2 baños con excelentes acabados 1 para doctores y 1 para pacientes en área de espera + Conexión para A/C centro al. Puerta con clave. Iluminación y ventilación natural. Elevador exclusivo para Doctores. (Con tarjeta). Edificio cuenta con: Lobby, 4 sótanos de parqueos visitas, Seguridad, Rooftop, Food Court, Pozo de agua Excelente vista hacia los Volcanes",Clínica Medica en Alquiler a ESTRENAR Renovati Zona 10,Renta,"USD1,100",Oficinas
"Detalles de CASA NUEVA EN VENTA ENTRADA A OLMECA, FRAIJANES CES   Hermosa casa nueva de 3 habitaciones , 3 baños, 2 salas, 3 estacionamientos, 1 estudio, y balcòn, en condomicio privado, seguro y muy bonito, en terreno de esquina, con 11 metros de frente y 21 de fondo. hermosos y finos acabados en tonos grises que son la ultima tendencia, tipo minimalista, tiene àrea de pergola y acceso a terraza El condominio cuenta con salòn para eventos, juegos para niños, y areas verdes. el mantenimiento mensual es de Q350 que incluye la segurida y el agia,  y un comodo pago de iusi trimestral.","CASA NUEVA EN VENTA ENTRADA A OLMECA, FRAIJANES CES",Venta,"Q1,050,000",Casas
"Detalles de Apartamento en venta en Cuatro Grados zona 4   Apartamento nuevo, modero en venta en el centro de la zona 4, ubicado sobre la 7 avenida frente al Centro Financiero cercado a todas las comodidades para tener una calidad de vida ahorrando tiempo, dinero en transporte, entre otras cosas.  Solo tienes que bajar al primero nivel y encontrar, restaurantes, tiendas y supermercados de conveniencia, cajeros, peluquerías, salones de belleza, gimnasio, panaderías, parada de transmetro y entre mucho otras ventajas que tendrías al vivir aquí, puedes rentar o comprar tu decides! Hermoso apartamento de 2 niveles con 3 habitaciones, 2 baños completos y baño d visitas, Sala-Comedor, balcón, cocina con gabinetes área de lavandería y parqueo,  cuenta con 105 mt2 de apartamento más 12.5 de parqueo para un total de 117.5mt2 En el edificio cuenta con amenidades para todas las edades,  - Terraza exterior para adultos con una vista espectacular al aire libre - Gameroom para los más pequeños de casa - Terraza techada para reuniones más formales - Gameroom para los jóvenes que desean ver alguna película, algún video juego y disfrutar en grande  Valor de venta más impuestos, valor de renta incluye mantenimiento más impuestos",Apartamento en venta en Cuatro Grados zona 4,Venta y Renta,"Q2,000,000",Apartamentos
"Detalles de Rento Amplio Apartamento de 200 Mts2 en Solaria Zona 16   Apartamento en Renta en Zona 16, bulevar la Montaña, Edificio Solaria El apartamento es amplio con una hermosa vista al bosque, con iluminación y ventilación natural.  En su ingreso cuenta con un área de terraza con vista al área verde y el bosque, sala, baño de visitas, comedor con ambiente amplio, cocina con top de granito, gabinetes y línea blanca en buen estado, amplia área de lavandería, calentador general de agua y dormitorio de servicio con baño completo.  adicionalmente cuenta con 1 habitación principal con walk in closet y baño completo con doble lavamanos, 2 habitaciones secundarias cada una con su propio baño y closet y 2 parqueos en sótano. El edificio se ubica en sector exclusivo, frente al colegio Ingles Americano, Universidad Rafael Landivar, Universidad del Valle, muy cercano a Ciudad Cayalá, centros comerciales, supermercados y tiendas de conveniencia. El edificio cuenta con parqueo de visitas en sótano, áreas verdes, área con juegos infantiles, área verde para mascotas, gimnasio, salón social, elevadores y seguridad. Renta incluye mantenimiento + Imp Mantenimiento.: Q1,350",Rento Amplio Apartamento de 200 Mts2 en Solaria Zona 16,Renta,"USD1,500",Apartamentos
"Detalles de Local en RENTA centro comercial en zona 5   Centro Comercial muy visitado en renta en zona 5 sobe le Bulevar Jardines de la Asunción, el centro comercial cuenta con Supermercado, bancos, farmacia, panadería, librería, entre otros comercios.  Los locales se están renovando, se entregan con piso, baños, cielo falso y pintados El local cuenta con 46.55 mt2 sin tabicar, un baño, . Centro comercial tiene parqueo de visitas, seguridad las 24 horas, cajeros automáticos  Renta incluye impuestos más mantenimiento Q325.85",Local en RENTA centro comercial en zona 5,Renta,"Q2,225",Locales comerciales
"Detalles de CityMax vende apartamento en Cassia zona 15   Apartamento en venta en Edificio Cassia zona 15 Ciudad de Guatemala , Excelente ubicación dentro de un entorno seguro, accesos inmediatos a Centros comerciales como Metro15, Vista Hermosa y Cayalá, ademas de la cercanía de parques. El apartamento Cuenta con 3 habitaciones, 2.5 baños, 2 parqueos, balcón con hermosa vista. Ambientes amplios y con mucha iluminación natural. Apartamento de 112Mts + 25Mts Estacionamientos Edificio de 17 niveles, con las siguientes amenidades en Nivel 1 y Ultimo Nivel: Lobby Juegos para niños Gimnasio Área verde Salón de eventos Área de Entretenimiento Lounge and Fire Pit Área Parrilladas Precio más Impuestos",CityMax vende apartamento en Cassia zona 15,Venta,"USD235,000",Apartamentos
"Detalles de Vendo Casa en Mirador de la Cruz Zona 18   Vendo Casa en Zona 18, Mirador de la Cruz, cuenta con un área de 101.68 m2 de terreno + 68.50 m2 de construcción + 6.20 m2 de frente + 5.90 m2 de fondo + 3 habitaciones + un parqueo para vehículo + 2 baños completos + sala + comedor + cocina + área de lavandería, cuenta con pozo + área sin construir de 33.18 m2",Vendo Casa en Mirador de la Cruz Zona 18,Venta,"Q330,000",Casas
"Detalles de Oficina en Alquiler Corporativo Muxbal   Oficina en alquiler con 85 Metros de oficinas con 7 ambientes, 1 baños, 2 parqueos propio, mantenimiento, garita y seguridad, internet, agua, luz, extracción de basura, recepción, sala de estar, 123 m2 de área de balcón con agradable vista a bosque en reserva privada. Bodega, sala de reuniones hasta para 12 personas 1.  Oficina 9.54 m2 con acceso a Balcón 2. Oficina 21.17 m2 con acceso a Balcón 3.  Oficina 11.85 m2 sin acceso a Balcón 4.  Balcón 5. Bodega 5m2 6. Recepción y Sala de estar  7. 2 parqueo 42 mts.",Oficina en Alquiler Corporativo Muxbal,Renta,"USD1,090",Oficinas
"Detalles de Apartamento en Residencial San Antonio km 16.5 CES   Apartamento en Residencial San Antonio km 16.5 Carretera a El Salvador , Residencial con área verde, seguridad 24/7   Ambientes: 1. Jardín  2. Pérgola  iluminada  3. Sala  4. Dormitorio  5. Cocina/comedor  6. Lavandería  7. 2 Baños  8. Cuarto de servicio y/o bodega. Amoblado  2. Parqueos  $1,000.00",Apartamento en Residencial San Antonio km 16.5 CES,Renta,USD715,Apartamentos
"Detalles de Lindo apartamento con vista al Bosque en zona 16 Guate   Apartamento en Venta en zona 16 Hacienda Real Entorno natural hermosasvistas  Dicho apartamento cuenta con 99 mts2 totales, incluyendo  2 habitaciones con opción 1 Flex, habitación principalcon closet y baño privado, habitación secundaria y baño,  2 Parqueos , cocina con gabinetes,desayunador y lavandería, cocina, sala comedor con balcón,  más sala familiar (2 salas)     Edificio cuenta con excelentes amenidades:  Movie Room, Kids games, Eléctrica bikes, Coffee lobby, Co-workinglavandería, Yoga place jacuzzi, Skylounge, Pet friendly, Seguridad play place,Parqueo de visitas,    Accesos a principales áreas comerciales.  Cuotas desde Q.6,000.00. Enganche desde el 8% Q88,040.00 Reserva: Q5,000",Lindo apartamento con vista al Bosque en zona 16 Guate,Venta,"Q1,006,862",Apartamentos
"Detalles de CityMax Vende Apartamento en zona 16 V.H. IV   Apartamento en Venta zona 16 Hacienda Real, Edificio residencial con excelente ubicación entorno natural hermosas vistas y accesos. El apartamento cuenta con 85Mts, incluyendo  2 Habitaciones con opción 1 Flex, 2 Baños, 2 Parqueos , cocina con gabinetes, desayunador y lavandería, sala comedor con balcón. Excelente Amenidades: Skylounge, Pet friendly, Seguridad play place, Parqueo de visitas, Movie Room, Kids games, Eléctrica bikes, Coffee lobby, Co-working lavandería, Yoga place jacuzzi. Accesos a principales áreas comerciales.  Reserva Q5,000 Cuotas desde Q.6,000.00 Enganche desde el 8% Q.66,832.00 Precio de venta incluye Impuestos",CityMax Vende Apartamento en zona 16 V.H. IV,Venta,"Q835,400",Apartamentos
"Detalles de Apartamento tipo casa en renta con muebles   Apartamento tipo Casa Amueblada en renta en zona 10 Guatemala. Muy cerca del Oakland Mall, Centro comercial La Estación, cerca de zona viva y zona hotelera de Guatemala. El edificio donde se encuentra tiene 3 ascensores, parqueo de visitas techado, planta eléctrica de emergencia, área para niños, salón de eventos, area de Parrilladas, seguridad, bussines center. El apartamento es de 2 niveles teniendo la siguiente distribución: Nivel 1: Recibidor, Sala Principal, Amplio Balcon, Sala familiar, amplio comedor con balcón, cocina eqyupafa con desayunador, dormitorio de servicio con bañ8, area de lavandería. Nivel 2:  Sala familiar o estudio, habitación principal con walkin closet, baño completo y balcón, habitación secundaria con closet y baño completo, 2 habitaciones secundarias con closet, baño completo secundario.",Apartamento tipo casa en renta con muebles,Renta,"USD2,500",Apartamentos
