description,name,operation,price,type
"Detalles de Oficina en Venta en Zona 10 en Edificio Ciudad Vieja   Oficina en Venta en la Zona 10 con un área de 56.74 m2 de construcción + 1.80 m2 de parqueo de moto, para un total de 58.54 m2 de construcción,  estará ubicado en edificio de uso mixto que contara con circuito cerrado, cámaras de seguridad las 245 hrs. cercano a centros comerciales de renombre, supermercados, tiendas de conveniencia, bancos del sistema.",Oficina en Venta en Zona 10 en Edificio Ciudad Vieja,Venta,"Q1,100,486",Oficinas
"Detalles de Renta local comercial Puerto de San Jose 50 mtrs2   En Alquiler local comercial en el puerto de San José, en área de Gasolinera.     Alto trafico, 50 metros de local. La Renta incluye agua potable, áreas comunes y extracción de basura.   Local incluye contador de energía eléctrica, baño propio, no incluye línea telefónica.  Local ideal para comida rápida, minimarket, petshop, farmacia, venta de celulares etc. Contrato mínimo 1 año. Sobre carretera Principal.  Renta + Iva.    Cercania con gasolinera, acceso a energia Trifasica",Renta local comercial Puerto de San Jose 50 mtrs2,Renta,"Q3,300",Locales comerciales
"Detalles de VENTA casa en LIKIN Puerto de San José Escuintla   CityMax vende hermosa casa vacacional dentro de condominio Likin Puerto de San José, a tan solo hora y media de la Ciudad de Guatemala. Tu casa vacacional o inversión es esta. Amplios ambientes iluminados con acceso directo a playa privada. Terreno de 845 Vrs2, construcción de 258mts2, 4 habitaciones, 4.5 baños, 3 parqueos. Cocina con barra y bar, sala comedor. Área social con hermosa piscina con amplio jardín, reciente construccion  Precio más Imp",VENTA casa en LIKIN Puerto de San José Escuintla,Venta,"USD280,000",Casas
"Detalles de Apartamentos en Venta en la Zona 11 Las charcas   Apartamento en Venta en la Zona 11 Las Charcas, Proyecto ubicado en sector exclusivo de la ciudad, cercano a áreas de comercio, tiendas de conveniencia, restaurantes, gasolineras, centros comerciales.  Salón Social Senderos Área infantil Business center área BBQ Sky Lounge El apartamento cuenta con 67 m2 de construcción solo de apartamento + 25 m2 de dos parqueos para vehículos, para un total de 92 m2 de construcción, cuenta con 2 habitaciones + 1 baños completo + sala + comedor + cocina.",Apartamentos en Venta en la Zona 11 Las charcas,Venta,"Q932,999",Apartamentos
"Detalles de APARTAMENTO DE UNA HABITACION EN ZONA 10   Amplio apartamento con 70 metros cuadrados en piso 3,  acceso por gradas, de 1 recamara, un baño completo y closet, un parqueo bajo techo, sala-comedor, cocina, muy bien iluminado y fresco, entorno natural, se entrega con línea blanca (refrigerador, estufa eléctrica, lava-secadora). también cuenta con portón eléctrico, bastante accesible al columpio vista hermosa, cerca de los hospitales y universidades de renombre. zona 10 ciudad de Guatemala, a 300 metros del campo marte. (no hay elevador) precio de renta incluye mantenimiento e impuestos.",APARTAMENTO DE UNA HABITACION EN ZONA 10,Renta,"Q4,500",Apartamentos
"Detalles de Local comercial en Renta en El Naranjo Mixco   Local  EN PRIMER NIVEL  ubicado en Plaza Comercial en Condado Naranjo cerca de viviendas, colegios, 10 proyectos Industriales como Pepsi, Nestlé, Codisa edificios de oficinas ubicado estratégicamente para atender a las zonas 3 y 4 de Mixco como zonas de centro 1, 2, 3, 7, 1 Plaza ubicada sobre el Boulevard el Naranjo cuenta con Todos los Bancos del sistema, Restaurantes, Supermercados, Empresas de Telefonía, gasolineras de fácil acceso. I Exposición de Marca a más de 85 mil vehículos que transitan sobre el Bulevar, Tráfico mensual de personas de 220 mil aproximadamente Local comercial de 74 mts2  Renta incluye impuestos y mantenimiento",Local comercial en Renta en El Naranjo Mixco,Renta,"USD2,072",Locales comerciales
"Detalles de Apartamento nuevo en Renta en zona 10 Guatemala   Hermosa vista a la ciudad edificio bien ubicado en zona 10, excelente amenidades tales como: gimnasio equipado, salón social, juegos para niños, jardín. Cuenta con espacios amplios e iluminados apartamento de 2 habitaciones con baño privado cada una, balcón en área social del apartamento, cocina equipada con linea blanca (refrigeradora, estufa, microondas, lavadora y secadora) 2. parqueos 1. balcón en sala En el primer nivel cuenta con bonita área social con plaza comercial, lobby con recepción y cafetería. Parqueo para visitas, juegos para niños, salón social,  La renta cuenta con el mantenimiento incluido",Apartamento nuevo en Renta en zona 10 Guatemala,Renta,"USD1,175",Apartamentos
"Detalles de Finca en Venta en San Pedro Carchá Cobán, Alta Verapaz   Finca en venta en Aldea Chijam, San Pedro Carcha, Alta Verapaz de 84,035.098 Varas2 Cercana a Centros Comerciales, mercados, agencias bancarias y vías de acceso y tránsporte público y extraurbano. La finca se ubica a 5 kilómetros del parque central de San Pedro Carcha, camino hacia el Oeste sobre carretera asfaltada y luego 2 kilómetros en terracería. La finca se conforma de 7 construcciones, las cuales se dividen en:  Casa Principal, Guardiania, Bodega, Establo, gallenero y dos tanques de captación.   La finca tiene forma de polígono regular ubicado a orilla de calle. Según plano topográfico, el inmueble posee un  área   física de 8 Manzanas (58,719Mts2)   La topografía es plana y con áreas de pendiente.  Cuenta con 2 nacimientos de agua,. árboles frutales como: Banano, Platano, Naranja, Tomate de Árbol, Durazno, Aguacate, Uva y más, 2 Manzanas de pasto para ganado, caballos u ovejas y 3 Manzanas de pino. Casa Principal:  cuenta con un un área de 114.54 m2. Está construida con Pinus Maximinoi y un área de block, el cual fue utilizado para cimientos y el muro. La vivienda cuenta con una habitación con baño privado y walk in closet, tres habitaciones, un servicio sanitario general, área de sala, comedor y cocina, la cual incluye gabinetes, azulejos y lavatrastos. Guardianía:  cuenta con construcción de madera y lamina, con dos ambientes, uno utilizado como habitación y un servicio sanitario, con un área total de 17m2 Bodega  de construcción de madera y lamina, con un área de 15 m2. único ambiente, utilizado como bodega. Establo : cuenta con una construcción a base de vigas y columnas de madera y techo de lámina, con un área de 150 m2. Gallinero:  con construcción a base de vigas y columnas de madera y techo de lámina, con un área de 10.24 m2. Dos tanques de captación de Agua: , uno con 3 m2 y el segundo con 12.06 m2 de área de construcción. El tanque de mayor área cuenta con bomba de pozo sumergible Goulds serie GA de 4” y motor centripro, la cual se encarga de enviar el agua hacia el tanque de distribución, y continuamente este distribuye a toda la propiedad por gravedad. Sistema de energía eléctrica, posee una acometida monofásica 110v del servicio de energía eléctrica proveniente de la red nacional de electrificación. Además de un sistema de drenajes con fosa séptica.","Finca en Venta en San Pedro Carchá Cobán, Alta Verapaz",Venta,"USD2,270,000",Fincas
"Detalles de Casa en venta para Inversión entrada a Olmeca, CES!!   Casa en Venta Para Inversión. La casa se encuentra ubicada en un excelente condominio que cuenta con doble ingreso, 1er ingreso por el Colegio Julio Verne, carretera a San José Pinula y el 2do ingreso se encuentra en el km 16.5 entrada a Olmeca CES. El condominio cuenta con excelente seguridad y bonitas amenidades tales como área de juego para niños, suficientes área verdes, salón social y canchas deportivas. La casa esta distribuida en 2 niveles En el primer nivel cuenta con sala, comedor, cocina con gabinetes, 1 estudio, baño de visitas, lavandería y pila, cuarto de servicio con baño, bodega y 2 parqueos. En el segundo nivel: Sala familiar Habitación principal con baño completo y WC 2 habitaciones secundarias muy bien iluminadas 1 baño completo que comparten las habitcaiones Balcón","Casa en venta para Inversión entrada a Olmeca, CES!!",Venta,"USD150,000",Casas
"Detalles de TERRENO COMERCIAL DE ESQUINA EN VILLA NUEVA   excelente oportunidad de inversión en Villa nueva, área comercial, terreno de 10 x 27.50 ubicado en esquina con excelente exposición, tiene facilidad de acceso, terreno plano, cerca de transporte, fabricas, en el puro casco de villa nueva. El terreno es ideal para construcción de locales comerciales, sala de ventas de alguna empresa de prestigio, academia, oficinas, bufete, o si desea solo aprovechar el terreno para parqueo o taller automotriz. financiamiento bancario disponible, apoyamos con el trámite, enganche desde 40%, contáctenos para mayor información financiera.  iusi trimestral Q126",TERRENO COMERCIAL DE ESQUINA EN VILLA NUEVA,Venta,"Q1,200,000",Terrenos
"Detalles de APARTAMENTO EN RENTA EN ALBERO 14    Elegante apartamento en renta en zona 14 con lindos acabados y cuenta con 3 habitaciones, cuarto de servicio, 3 baños completos con manpara y espejos con luz led, la habitación cuenta con walking closet, baño privado y los 2 secundarios con closet y baño compartido, sala, comedor, cocina abierta con horno y plancha, microonda, refrigeradora de 2 puertas, la sala tiene chimenea decorativa, lavandería, balcón bastante amplio, en la sala con una bella vista, baño de visitas con ducha, 2 parqueos y 1 bodega Edificio cuenta con área social, juegos para niños, área verde, Business center, gimnasio, área de churrasquera y Jacuzzi.",APARTAMENTO EN RENTA EN ALBERO 14 ,Renta,"USD1,750",Apartamentos
"Detalles de Oficina en renta en zona 9 Cerca de Montufar   Oficinas en Alquiler en zona 9 Ciudad de Guatemala, con excelente ubicación cerca de áreas comerciales, areas gastronomicas, areas corporativas,  el famoso parque de la Industria, parqueos públicos,calle Montufar y restaurantes. Pequeño edificio corporativo con ascensor, seguridad.  La Oficina en renta es de 85mts2 y c uenta con dos ambientes, y recepción, 1 Parqueo .  Seguridad 24 horas, parqueo para visitas. Renta másmantenimiento Q.1, 275.00 más IVA",Oficina en renta en zona 9 Cerca de Montufar,Renta,USD850,Oficinas
"Detalles de Alquiler de Apartamento Amueblado zona 10 Guatemala   RENTA Apartamento en edificio céntrico en zona 10Guatemala  Edificio bien ubicado en el centro de zona 10,excelentes amenidades para relajarte como piscina y gimnasio, seguridad 24horas, accesos inmediatos a Centros comerciales, supermercados y restaurantesreconocidos. Apartamento totalmente amueblado y equipado.  Sala familiar,  cocina con gabinetes y línea blanca, comedor.Habitación principal con walk in closet y baño completo, 2 dormitorios concloset y baño completo compartido, área de lavandería, dormitorio de serviciocon baño completo, balcón, 2 parqueos.    La renta incluye el mantenimiento",Alquiler de Apartamento Amueblado zona 10 Guatemala,Renta,"USD1,500",Apartamentos
"Detalles de En Renta local área Food Court sobre Carretera en Plaza   En Plaza o centro Comercial sobre Carretera Principal, parqueos, servicios como bancos, clínicas medicas, supermercados, gasolinera, restaurantes, panaderías etc Plaza con gran afluencia comercial, parqueos, seguridad  las 24 horas. El local incluye conexión y contador de Gas, campana de Extracción de humo y olores, Ventanillas para paso de alimentos y mobiliario de mostrador de despacho y atención  al publico.   En el área se encuentran mesas y sillas que pertenecen a la plaza, área bajo techo. Piso de cerámico claro.  Mantenimiento incluye agua potable, extracción de basura, seguridad común, limpieza en áreas comunes. Depósito en garantía es una renta sin IVA, local cuenta con contador de energía eléctrica, no cuenta con línea telefónica. Parqueo en sótano para condomines.  Horario de 7am a 9 de la noche.",En Renta local área Food Court sobre Carretera en Plaza,Renta,USD750,Locales comerciales
"Detalles de Se renta local comercial 2do nivel Plaza en San Lucas   En Alquiler local 85 metros en Plaza o centro Comercial San Lucas Sacatepéquez sobre Carretera Principal, parqueos, servicios como bancos, clínicas y servicios medicos, supermercados, , gasolinera, venta de ropa etc. Plaza con gran afluencia comercial, parqueos, seguridad  las 24 horas.  Mantenimiento incluye agua potable, extracción de basura, seguridad común, limpieza en áreas comunes. Depósito en garantía es una renta sin IVA, local cuenta con contador de energía eléctrica, no cuenta con línea telefónica. Parqueo en sótano para condomines.  Horario de 7am a 9 de la noche.  Listas para entregar en Julio 2022. Parqueo gratis para clientes del centro Comercial  RENTA tiene incluido mantenimiento + Impuestos Listos para entrega en Julio 2022. Se ven desde parqueo de la plaza, se encuentran en un 2do nivel con ventanales",Se renta local comercial 2do nivel Plaza en San Lucas,Renta,"USD1,131",Locales comerciales
"Detalles de En Alquiler local comercial 60Mts Plaza de San Lucas    En Alquiler local de 60 metros en Plaza de San Lucas sobre carretera interamericana, parqueos, servicios como bancos, clínicas dentales, oftalmologicas etc, supermercados, , gasolinera, venta de ropa,  entre otros. Plaza con gran afluencia comercial, parqueos, seguridad  las 24 horas.  Mantenimiento incluye agua potable, extracción de basura, seguridad común, limpieza en áreas comunes. Depósito en garantía es una renta sin IVA, local cuenta con contador de energía eléctrica, no cuenta con línea telefónica. Parqueo en sótano para condomines.  Horario de 7am a 9 de la noche.  Listas para entregar en Julio 2022. Parqueo gratis para clientes del centro Comercial. RENTA tiene incluido mantenimiento + Impuestos Listos para entrega en Julio 2022. Se ven desde parqueo de la plaza, se encuentran en un 2do nivel con ventanales.  Cuota de Mantenimiento incluida en Renta + impuestos",En Alquiler local comercial 60Mts Plaza de San Lucas ,Renta,USD798,Locales comerciales
"Detalles de En Renta local en San Lucas Sacatepéquez   En Plaza o centro Comercial sobre Carretera Principal, parqueos, servicios como bancos, clínicas dentales, oftalmologicas etc, supermercados, , gasolinera, venta de ropa,  entre otros, Plaza con gran afluencia comercial, parqueos, seguridad  las 24 horas. Mantenimiento incluye agua potable, extracción de basura, seguridad común, limpieza en áreas comunes. Depósito en garantía es una renta sin IVA, local cuenta con contador de energía eléctrica, no cuenta con línea telefónica.  Listos para entrega en Julio 2022. Se ven desde parqueo de la plaza, se encuentran en un 2do nivel con ventanales.  Cuota de Mantenimiento incluida en Renta + impuestos Parqueo en sótano para condomines.  Horario de 7am a 9 de la noche.  Listas para entregar en Julio 2022. Parqueo gratis para clientes del centro Comercial. RENTA tiene incluido mantenimiento + Impuestos",En Renta local en San Lucas Sacatepéquez,Renta,USD798,Locales comerciales
"Detalles de Renta local en San Lucas Sac. plaza sobre Carretera   En Plaza o centro Comercial sobre Carretera Principal, parqueos, servicios como bancos, clínicas dentales, oftalmologicas etc, supermercados, , gasolinera, venta de ropa,  etc. Plaza con gran afluencia comercial, parqueos, seguridad  las 24 horas.  Mantenimiento incluye agua potable, extracción de basura, seguridad común, limpieza en áreas comunes. Depósito en garantía es una renta sin IVA, local cuenta con contador de energía eléctrica, no cuenta con línea telefónica. Parqueo en sótano para condomines.  Horario de 7am a 9 de la noche.  Listas para entregar en Julio 2022. Listos para entrega en Julio 2022. Se ven desde parqueo de la plaza, se encuentran en un 2do nivel con ventanales.  Cuota de Mantenimiento incluida en Renta + impuestos. Parqueo gratis para clientes del centro Comercial. RENTA tiene incluido mantenimiento + Impuestos Comercios sugeridos: gimnasio, tiendas de muebles, oficinas de atención al cliente tipo Claro, Tigo; artículos médicos...Contrato en escritura pública de 1 a 35 meses. incremento en rentas del 5% inter anual.  Deposito 1 renta sin impuestos",Renta local en San Lucas Sac. plaza sobre Carretera,Renta,USD798,Locales comerciales
"Detalles de Oficina en Venta en Planos en Zona 16 CAYALA   Oficina en Venta en la Zona 16 de Cayala, contara con 101.47 m2 de construcción + un medio baño. Estará ubicado dentro de proyecto de apartamentos que consiste en un desarrollo de 6 torres de uso mixto con comercio en la planta baja y apartamentos en los niveles superiores.  Proyecto rodeado de amplias áreas verdes, supermercados, tiendas de conveniencia, gasolineras, restaurantes en el sector, seguridad las 24 hrs. amplio parqueo para visitas. Las divisiones de los inmuebles serán de muro de mamposetría al igual que los cerramientos perimetrales al exterior. Los acabados en los muros son, en el interior block expuesto y en el exterior texturizado Santa Fé en los edificios A y B y concreto martelinado en la torre C. •Sus losas son de concreto reforzado con una tolerancia de nivelación de +/ 1.5cm, dejando una base a 0.02m sobre el NPT para instalación de piso. •Se entrega sin acabados en cielos vigas y losas de concreto expuesto resanado. •Los inmuebles se entregarán con puertas y ventanería de vidrio monolítico con perfilería de aluminio según diseño de cada oficina. Las oficinas no estarán comunicadas al vestíbulo interior de los edificios. •La altura de piso a piso de los inmuebles en el primer nivel serán de 4.00m en las torres A y C mientras que los inmuebles en la torre B tendrá 5.00m.",Oficina en Venta en Planos en Zona 16 CAYALA,Venta,"USD322,606",Oficinas
"Detalles de Oficina en Venta Zona 16 de Lirios de Cayala PLANOS   Proyecto que consiste en un desarrollo de 6 torres de uso mixto con comercio en la planta baja y apartamentos en los niveles superiores, contara con amplias areas verdes, parqueo de visitas, tiendas de conveniencia, supermercados, restaurantes, bancos del sistema.  Oficina en venta con un área de construcción de 101.47 m2  Las divisiones de los inmuebles serán de muro de mamposetría al igual que los cerramientos perimetrales al exterior. Los acabados en los muros son, en el interior block expuesto y en el exterior texturizado Santa Fé en los edificios A y B y concreto martelinado en la torre C. •Sus losas son de concreto reforzado con una tolerancia de nivelación de +/ 1.5cm, dejando una base a 0.02m sobre el NPT para instalación de piso. •Se entrega sin acabados en cielos vigas y losas de concreto expuesto resanado. •Los inmuebles se entregarán con puertas y ventanería de vidrio monolítico con perfilería de aluminio según diseño de cada oficina. Las oficinas no estarán comunicadas al vestíbulo interior de los edificios. •La altura de piso a piso de los inmuebles en el primer nivel serán de 4.00m en las torres A y C mientras que los inmuebles en la torre B tendrá 5.00m.",Oficina en Venta Zona 16 de Lirios de Cayala PLANOS,Venta,"USD322,606",Oficinas
"Detalles de Casa en venta en Lomas de San Fermin zona 21 Guatemala   Casa enventa en residencial privado pocas casas, cerca de boulevard principal, congarita de seguridad, a pocos km de Calzada Atanasio Tzul   y Avenida Petápa zona 12.     Propiedadde:     6 mts defrente  17 mt2 defondo  Construcción100 m2  Propiedadconstruida desde 2003     la descripciónde la vivienda:     3habitaciones  3 baños  Habitacionde servicio  Lavandería  Estacionamientopara 3 vehículos  2 nivelesconstruidos  Patiotrasero   Cuota de mantenimiento Q390.00  (Agua, seguridad, extracción de basura y mantenimiento areas comunes).  Precio deventa más impuestos y gastos legales",Casa en venta en Lomas de San Fermin zona 21 Guatemala,Venta,"Q975,000",Casas
"Detalles de Oficina nueva en renta en zona 9 sector Montufar   Moderna oficina en renta en el centro de la zona 9, cercano a paradas de transmetro, bancos, restaurantes, comercio y centros de salud, entre otros. Cuenta con 2 accesos uno sobre la 12 calle y el otro sobre la 13 calle de zona 9, peatonal y vehicular con parqueo en sótano para visitas y condóminos, la oficina cuenta con 35mt2 con baño, cuenta con un parqueo. Oficina ideal para abogados, contadores, clínicas médicas, entre otros  El edificio cuenta con batería de baños en cada nivel, locales comerciales, elevadores, gradas desde el sótano. Valor de renta cuenta con mantenimiento más impuestos",Oficina nueva en renta en zona 9 sector Montufar,Renta,"Q6,000",Oficinas
"Detalles de Oficina nueva en renta en zona 9, cerca a la 7 Avenida   Moderna oficina en renta en el centro de la zona 9, cercano a paradas de transmetro, bancos, restaurantes, comercio y centros de salud, entre otros. Cuenta con 2 accesos uno sobre la 12 calle y el otro sobre la 13 calle de zona 9, peatonal y vehicular con parqueo en sótano para visitas y condóminos, la oficina cuenta con 35mt2 con baño, cuenta con un parqueo. Oficina ideal para abogados, contadores, clínicas médicas, entre otros  El edificio cuenta con batería de baños en cada nivel, locales comerciales, elevadores, gradas desde el sótano. Valor de renta cuenta con mantenimiento más impuestos","Oficina nueva en renta en zona 9, cerca a la 7 Avenida",Renta,"Q6,000",Oficinas
"Detalles de Oficina de 71 mts en alquiler en el centro de la zona 9   Modernas oficinas en renta en el centro de la zona 9, cercano a paradas de transmetro, bancos, restaurantes, comercio y centros de salud, entre otros. Cuenta con 2 accesos uno sobre la 12 calle y el otro sobre la 13 calle de zona 9, peatonal y vehicular con parqueo en sótano para visitas y condóminos, la oficina cuenta con 71.40mt2 con 2 baños, cuenta con dos parqueos. (SON 2 OFICINAS Y LAS CUALES SE PUEDEN RENTAR POR SEPARADO) Oficina ideal para abogados, contadores, clínicas médicas, entre otros  El edificio cuenta con batería de baños en cada nivel, locales comerciales, elevadores, gradas desde el sótano. Valor de renta cuenta con mantenimiento más impuestos",Oficina de 71 mts en alquiler en el centro de la zona 9,Renta,"Q12,000",Oficinas
"Detalles de Apartamento en renta en zona 14 sector la Villa     Apartamento en alquiler de 2 habitaciones en zona 14 Sector de la Villa cercano a colegios, universidades, centros comerciales, bancos del sistema y centros de negocios el apartamento cuenta con: - Cocina equipada - Sala - Comedor  - Bar - 2 habitaciones (principal con w/c y baño) - Baño de visitas - 2 parqueos La vista es muy linda ya que se encuentra en un sexto nivel y el apartamento es totalmente iluminado.  El proyecto cuenta con: Gimnasio Baby Gym Salón Social Salas Lounge  Área verde con juegos de niños Renta incluye mantenimiento,  El mantenimiento incluye: extracción de basura, agua, mantenimiento de áreas comunes, áreas verdes, gimnasio, salón social, elevadores y seguridad 24 horas.",Apartamento en renta en zona 14 sector la Villa  ,Renta,USD850,Apartamentos
"Detalles de Venta de terreno Residencial en El Tejar Chimaltenango   Terreno en venta totalmente plano a nivel de la calle, Ingreso calle deterracería. El acceso es por la calle que va al Caserío Santo Domingo ElRosario,  El Tejar Chimaltenango.  Son dos  lotes juntos  978 mts2  Acceso a iglesias y comercios locales a menos de un kilómetro.    Sin urbanización, sin banquetas ni bordillos en ambos lados de la calle.",Venta de terreno Residencial en El Tejar Chimaltenango,Venta,"Q195,000",Terrenos
"Detalles de Apartamento AMUEBLADO en la Zona 4 Edififio QUO   Rento Apartamento AMUEBLADO en la Zona 4 de Guatemala, cuenta con un área de 38 m2 de construcción + 12.5 m2 de un parqueo para vehículo + una habitación + baño completo + sala + comedor + cocina.  El edificio donde se encuentra cuenta con, área de comercio, gimnasio, restaurantes, tiendas de conveniencia, seguridad las 24 hrs. cercano a transporte públicos.  PRECIO SIN MUEBLES $700.00",Apartamento AMUEBLADO en la Zona 4 Edififio QUO,Renta,USD825,Apartamentos
"Detalles de RENTA o VENTA terreno sobre Calzada Roosevelt Guatemala   Terreno en Venta o Alquiler de 8,186 varas en renta Sobre Calzada Roosevelt, ideal para almacenaje, parqueo de camiones, gasolinera, bodega entre otros. Excelente ubicación por tener alto tránsito vehicular, con acceso directo la carretera que lleva a Sacatepéquez, A Mixco, a Ciudad Quetzal. Cuenta con vocación netamente comercial, totalmente plano  Cuenta con 90 metros de Frente por 70 metros de Fondo. haciendo un total de 5,700 es decir  8, 186 VRS2",RENTA o VENTA terreno sobre Calzada Roosevelt Guatemala,Venta y Renta,"USD10,232,500",Terrenos
"Detalles de CityMax renta de oficina en Plaza ubicada en zona 10   Oficina bien ubicada en zona 10 Ciudad Guatemala Excelente ubicación, accesos inmediatos a Centros comerciales como Oakland y Desing Center.  Excelentes medidas de Seguridad y amplio parqueo para visitas techado, planta de emergencia con escalera exterior de emergencia, seguridad 24 horas con CC. Ubicada en primer nivel  (planta baja) 66mts2, 2 tabicaciones, iluminación led,  1 baño, 3 parqueos   (1 privado y 2 en derecho) Incluye el mantenimiento. Más IVA",CityMax renta de oficina en Plaza ubicada en zona 10,Renta,USD650,Oficinas
