description,name,operation,price,type
"Detalles de Oficina en Penthouse en Renta Zona 10   Oficina de dos niveles disponible en Nivel ALTO en Renta Zona 10 de Guatemala, el Edificio esta cercano a áreas de comercio, restaurantes de renombre, supermercados, transportes públicos,  la Oficina en renta tiene un área de  892 m2 de construcción + área de recepción + 12 baños + 10 oficinas + espacios abiertos. Precio de renta con mantenimiento e Impuestos incluidos Parqueo tiene un costo de $100 mas Imp Tarifa de parqueo para visitas 30 minutos Q10.00 una hora Q20.00 Precio de renta con impuesto y Mantenimiento",Oficina en Penthouse en Renta Zona 10,Renta,"USD13,500",Oficinas
"Detalles de Apartamento en Alquiler Villa Risho Zona 14 con 336Mts   Apartamento en Alquiler en la Zona 14 de Guatemala y tiene 301.836 m2 de construcción distribuidos así:  Área de Lobby Sala y comedor con balcón  Sala familiar  Baño de Visitas  Cocina totalmente equipada y pantry Despensa  3 habitaciones  Dormitorio principal con balcón, walk in closet, closet, baño y jettina  Dormitorio dos con balcón, closet y baño Dormitorio tres con balcón, closet y baño  Cuarto de servicio  Área de lavandería  1 bodega  parqueo 3 vehículos  Edificio con: Piscina, Salon Eventos, Gimnasio, Area Verde, Area Niños, estacionamiento de visitas, lobby, salas de espera",Apartamento en Alquiler Villa Risho Zona 14 con 336Mts,Renta,"USD2,500",Apartamentos
"Detalles de Ofibodega en ZENTRO PLAZA SUR, zona 12    Bodega en Alquiler en la Zona 12 de Guatemala, la ofibodega cuenta con un área de 450 m2 de construcción, el complejo cuenta con garita de seguridad las 24 hrs. area de carga y descarga, parqueo de visitas, esta ubicado en una zona industrial de mucha afluencia vehicular y peatonal. Ofibodega en Renta en la Zona 12 Precio de Renta $6.50 x m2 + impuesto Mantenimiento $1.00 x m2. + impuesto","Ofibodega en ZENTRO PLAZA SUR, zona 12 ",Renta,"USD3,375",Bodegas/Naves industriales
"Detalles de Alquiler de oficina en zona 4 Cuatro Grados Norte   CityMaxrenta oficina es para 4 personas, cuenta con 6.20mts2  Incluyemobiliario, (mesas y sillas) aire acondicionado, dirección fiscal, apoyo en recepciónde llamadas y documentos, acceso a internet gratis (10MB) si necesita más$.3.00 por MB extra. Desinfección y Desinfección limpieza diaria, acceso a coworking ilimitado, 8 horas para uso de reuniones  Edificiocuenta con 2. Lobbies de ingreso, terraza con área libre, seguridad 24 horas.Accesos a bancos, restaurantes y centros comerciales.  Larenta cuenta IMP incluidos",Alquiler de oficina en zona 4 Cuatro Grados Norte,Renta,"Q3,415",Oficinas
"Detalles de Oficina en renta en zona 4 Ciudad de Guatemala   CityMax alquila oficina en zona 4 Guatemala, Esta oficina cuenta con 12.10mts2, excelente ubicación en zona 4, cerca de áreas comerciales, restaurantes, GYM, plazas comerciales, transporte público.   CityMaxrenta oficina es para 4 personas, cuenta con 6.20mts2  Elalquiler de esta oficina aire acondicionado, dirección fiscal, apoyo en recepciónde llamadas y documentos, Incluye mobiliario, (mesas y sillas) acceso ainternet gratis (10MB) si necesita más $.3.00 por MB extra. Desinfección y Desinfecciónlimpieza diaria, acceso a co working ilimitado, 8 horas para uso de reuniones  Edificiocuenta con 2. Lobbies de ingreso, terraza con área libre, seguridad 24 horas. Larenta cuenta IMP incluidos",Oficina en renta en zona 4 Ciudad de Guatemala,Renta,"Q6,098",Oficinas
"Detalles de cityMax alquila oficinas en zona 4   Alquilerde oficina en zona 4 Guatemala  Oficinaprivada para 4 personas, cuenta con 6.20mts2  Elalquiler de esta oficina aire acondicionado, dirección fiscal, apoyo en recepciónde llamadas y documentos, Incluye mobiliario, (mesas y sillas) acceso ainternet gratis (10MB) si necesita más $.3.00 por MB extra. Desinfección y Desinfecciónlimpieza diaria, acceso a co working ilimitado, 8 horas para uso de reuniones  Edificiocuenta con 2. Lobbies de ingreso, terraza con área libre, seguridad 24 horas. Larenta cuenta IMP incluidos   IMP incluidos",cityMax alquila oficinas en zona 4,Renta,"Q3,415",Oficinas
"Detalles de Oficinas en renta ubicadas en zona 4 Guatemala   CityMax rentaOficina privada para 13 personas, cuenta con 25.60mts2  Cuentacon aire acondicionado, dirección fiscal, apoyo en recepción de llamadas ydocumentos, Incluye mobiliario, (mesas y sillas) acceso a internet gratis(10MB) si necesita más $.3.00 por MB extra. Desinfección y Desinfección limpiezadiaria, acceso a co working ilimitado, 26 horas para uso de salas de reuniones  Edificiocuenta con 2. Lobbies de ingreso, terraza con área libre, seguridad 24 horas. Larenta cuenta IMP incluidos",Oficinas en renta ubicadas en zona 4 Guatemala,Renta,"Q9,910",Oficinas
"Detalles de Oficina en zona 4 Ciudad Guatemala   Oficinaprivada para 4 personas en alquiler en zona 4  Esta oficinacuenta con 6.70mts2  Apoyoen recepción de llamadas y documentos, aire acondicionado, dirección fiscal, Incluyemobiliario, (mesas y sillas) acceso a internet gratis (10MB) si necesita más$.3.00 por MB extra. Desinfección y Desinfección limpieza diaria, acceso a co-workingilimitado, 8 horas para uso de salas de reuniones  Edificiocuenta con 2. Lobbies de ingreso, terraza con área libre, seguridad 24 horas. Larenta cuenta IMP incluidos",Oficina en zona 4 Ciudad Guatemala,Renta,"Q3,415",Oficinas
"Detalles de Rento Oficina en Zona 10 con 154 m2 TABICADA   Oficina Tabicada en Renta en la zona 10, cercano a avenida reforma, áreas de comercio, tiendas de conveniencia, gasolineras, bancos del sistema, restaurantes de renombre y transportes públicos.  la oficina cuenta con un área de 154 m2 de construcción  área de recepción  5 oficinas dos baños  Espacio abierto en el centro de la oficina.  Precio de renta con mantenimiento e Impuestos incluidos Parqueo tiene un costo de $100 mas Imp Tarifa de parqueo para visitas 30 minutos Q10.00 una hora Q20.00",Rento Oficina en Zona 10 con 154 m2 TABICADA,Renta,"USD1,985",Oficinas
"Detalles de Oficina en Alquiler Zona 10 cerca Fontabella   Oficina en renta zona 10  distribución de 5 ambientes de oficinas, una sala de reuniones, cocineta, dos baños. El edificio esta ubicado en la zona exclusiva de la zona 10, cercano a Zona viva, tiendas de conveniencia, restaurantes de renombre, supermercados, gasolineras y bancos.  Precio de renta con mantenimiento aire acondicionado  e Impuestos incluidos Parqueo tiene un costo de $100 mas Imp Tarifa de parqueo para visitas 30 minutos Q10.00 una hora Q20.00",Oficina en Alquiler Zona 10 cerca Fontabella,Renta,"USD2,360",Oficinas
"Detalles de Alquilo oficina en Murano Center Zona 10 Guate   Oficina Tabicada cercano a áreas de comercio, tiendas de conveniencia, bancos del sistema, restaurantes de renombre, hoteles, supermercados  y trasportes públicos.  zona 10 Guatemala la oficina cuenta con:  03 oficinas  una bodega un baño.  Precio de renta con mantenimiento e Impuestos incluidos *Parqueo tiene un costo de $112 con impuestos* Tarifa de parqueo para visitas 30 minutos Q10.00 una hora Q20.00",Alquilo oficina en Murano Center Zona 10 Guate,Renta,"USD1,015",Oficinas
"Detalles de Oficina en alquiler en zona 4 de Mixco Edificio Crece    Oficina en Renta en El Naranjo zona 4 Mixco, 55 mts2 + 1 parqueo en total 67mt2 . Edificio Moderno que cuenta con alta seguridad 24 horas, planta eléctrica en áreas comunes, oficina abierta en excelente ubicación, cercana áreas comerciales restaurantes y accesos, promociona, recepción, sala de reuniones, en la planta baja cuenta con  centro comercial a su disposición.   Un edificio moderno en la zona de alto crecimiento ejecutivo, industrial y residencial, el edificio tiene 12 niveles de oficinas 3 elevadores, sistema automatizado de seguridad,   Así mismo el edificio cuenta con amenidades para hacer más eficiente las jornadas laborales como - Salas de reuniones con capacidad de 4, 8 y 12 personas - Salón para capacitaciones - Cafetería con capacidad de 30 personas - Sala de convicencia - lobby - Terraza con jardín  Renta incluye mantenimiento + impuestos - Hay opción de rentar parqueo adicional, (depende disponibilidad)  Hay 2 tipos: Q600 en sótano Q400 primer nivel, no techado",Oficina en alquiler en zona 4 de Mixco Edificio Crece ,Renta,"Q6,000",Oficinas
"Detalles de Renta oficina Moderna zona 15 nuevo Centro Empresarial   En área de crecimiento constante, varios accesos. moderno bien ubicado y de crecimiento cercano a pulmón verde dentro de la  ciudad.   Perteneciente a grupo de crecimiento constante, este nuevo centro Empresarial se encuentra rodeado de naturaleza, calles en buen estado, con accesos y servicios varios a la par, dentro del mismo completo.  En sus alrededores se encuentran, bancos, centros comerciales de constante auge y crecimiento, supermercados, universidades, colegios, área comercial muy activa, en crecimiento constante.  Zona muy atractiva. Oficina de esquina  159.90 metros +  4 parqueos propios . Nivel intermedio, vista impresionante, se entrega en obra gris y con instalación y tubería para todo tipo de servicios.  El inquilino podrá escoger según su giro de negocio y necesidades que tipo de instalación y diseño que necesite dentro de oficina.    El edificio cuenta con parqueos para inquilinos, parqueo para visitantes, restaurantes, librerías, farmacias  y un sin fin de servicios.   El edificio cuenta con su propia planta de tratamiento de agua  y celdas Paneles solares.  El contador de electricidad se tramita a nombre del inquilino.  Cuenta con servicios Sanitarios en caso no considere necesario la creación de los mismos dentro del área de la oficina.  Instalaciones listas para conexión de instalaciones y servicios. LA RENTA ACTUAL INCLUYE LOS 4 PARQUEOS + Imp La oficina se entrega en obra gris, no tiene pisos, ni pintura ni revestimientos.   Baños por nivel.   Cada inquilino tiene la opcion de tabicar la oficina y construir su propio servicio sanitarios dentro de oficinas, instalaciones listas.",Renta oficina Moderna zona 15 nuevo Centro Empresarial,Renta,"USD2,630",Oficinas
Detalles de Ofibodega en venta en VERDESUR Mazatenango   Ofibodega en venta en Mazatenango con un área total de 446.35 m2 distribuidos así:  Dimensiones 12.50 m x 23.05 m Almacenaje 288.12 m2 Oficina en Mezanine 95.73 m2 Parqueos 5 por bodega  Baños 1 por bodega El proyecto contara con:  Area de Carga y descarga Garita de Seguridad Parqueo de visitas para carros y motos Oficina de Administración  Bodega equipada con utensilios y equipo básico de mantenimiento Baños de hombres y mujeres con duchas Salón de capacitaciones Kioscos de comida en primer nivel Tótem para exposición de su marca.,Ofibodega en venta en VERDESUR Mazatenango,Venta,"USD353,699",Bodegas/Naves industriales
Detalles de OFIESPACIO EN VENTA EN VERDESUR Mazatenango Km 162.5   El proyecto de Bodegas y Comercio contara con:  Area de Carga y descarga Garita de Seguridad Parqueo de visitas para carros y motos Oficina de Administración  Bodega equipada con utensilios y equipo básico de mantenimiento Baños de hombres y mujeres con duchas Salón de capacitaciones Kioscos de comida en primer nivel Tótem para exposición de su marca. el Ofiespacio cuenta con las siguiente medidas total de 294.71 m2 distribuidos así: Dimensiones 7.65 x 23.05 m2 Almacenaje 176.33 m2 Oficina en Mezanine 118.38 m2 Parqueos 3 por bodega Baños 1 por bodega,OFIESPACIO EN VENTA EN VERDESUR Mazatenango Km 162.5,Venta,"USD268,305",Bodegas/Naves industriales
Detalles de Oficina en Renta en Zona 10 Edificio Murano   Alquilo Oficina con un área de 533 m2 de Construcción distribuidos así:  Amplia área de recepción  Área abierta  3 oficinas amplias  Sala de reuniones  cocineta  8 sanitario  Acceso a Terraza  aire acondicionado  Precio de Renta con Mantenimiento e Impuesto y incluido,Oficina en Renta en Zona 10 Edificio Murano,Renta,"USD6,355",Oficinas
"Detalles de Alquilo Oficina de 183 m2 en Zona 10 Zona VIVA   Renta de Oficina en Zona 10, cercano a áreas de comercio, restaurantes de renombre, bancos del sistema, gasolineras, la oficina cuenta con un área de 183 m2 de construcción y tiene las siguientes divisiones:  2 oficinas, 2 baños, Espacio abierto al centro de la oficina, amplio espacio para área de recepción.  PRECIO DE RENTA CON MANTENIMIENTO E IMPUESTO",Alquilo Oficina de 183 m2 en Zona 10 Zona VIVA,Renta,"USD2,155",Oficinas
"Detalles de Oficina Comercial en Renta de 97Mts en Zona 10   Oficina en Alquiler en la Zona 10 de Guatemala con un área de 97 mts2 de construcción distribuidos así:  Área de Recepción  Una Oficina  Dos baños  Excelente espacio abierto al centro de la oficina  El edificio esta cercano a la zona viva de la Zona 10, restaurantes de renombre, supermercados, tiendas de conveniencia.",Oficina Comercial en Renta de 97Mts en Zona 10,Renta,"USD1,140",Oficinas
"Detalles de Oficina de 97 m2 en RENTA en Zona 10   Alquilo Oficina en zona 10 con un área de construcción 154 mts2 Área de Recepción  Tres oficinas  dos  baño La renta incluye mantenimiento e IVA El edificio cuenta con seguridad las 24 horas. parqueo de visitas, elevadores, cercano a tiendas de conveniencia, restaurantes de renombre, bancos del sistema y transportes públicos .",Oficina de 97 m2 en RENTA en Zona 10,Renta,"USD1,985",Oficinas
"Detalles de Rento Oficina de 154 m2 en Zona Viva Zona 10   Oficina de 154 m2 de construcción en alquiler cercano a la zona viva de la Zona 10 Guatemala, cuenta con:  Área de recepción  Tres oficinas  dos baños  Área de cubículos  Edificio en en Zona 10, con seguridad las 24 hrs, parqueo de visitas, dos elevadores, cercano a áreas de comercio, restaurantes de renombre, bancos del sistema y tiendas de conveniencia.",Rento Oficina de 154 m2 en Zona Viva Zona 10,Renta,"USD1,985",Oficinas
"Detalles de APARTAMENTO EN VENTA ZONA 14 SANTORINI   Apartamento amueblado, de 90mt2 recién remodelado, con alfombra y piso laminado de madera, en uno de los Edificios mas exclusivos de zona 14, Santorini. 2 habitaciones  2 baños completos con tina Espacio para lavadora y secadora de torre. 2 parqueos en sótano, uno a la par del otro frente a los ascensores.  El edificio cuenta con dos ascensores, salón social y parqueo de visitas.  precio de venta de $150,000 incluye muebles, + gastos de escrituración e impuestos de ley.",APARTAMENTO EN VENTA ZONA 14 SANTORINI,Venta,"USD150,000",Apartamentos
"Detalles de Nivel completo de Oficinas en alquiler en zona 10    Esta oficina cuenta con amplios espacios, iluminados y ventilación natural. Energía eléctrica Bifásica Cuenta con  749.13 mts2, 24 ambientes, 11 baños, 16 parqueos.  Excelente ubicación en zona 10, en el corazón de zona 10 Accesos a centros comerciales, restaurantes.  La renta incluye el mantenimiento, más IMP",Nivel completo de Oficinas en alquiler en zona 10 ,Renta,"USD6,172",Oficinas
"Detalles de Apartamento en Providencia zona 13   Vendo Apartamento en Zona 13 Cercano a Avenida las Américas, Contara con un área de 78 m2 de construcción + 25 m2 de 2 parqueos para vehículo tipo tándem, 2 baños completos, un balcón, el apartamento puede contar con 2 o 3 habitaciones El Edifico cuenta con las siguientes amenidades:  Green place  Zen Garden BBQ Spots  Fit Room Garden Beauty Pet  Party zone Sky Lounge Green Roof Top  Business Center Toddler Room Kids Playground  Social Deck",Apartamento en Providencia zona 13,Venta,"USD159,550",Apartamentos
"Detalles de Apartamento en zona 13 en Venta    Proyecto de apartamento en zona 13 cercano a Avenida las Américas, cuenta con:  Green place  Zen Garden BBQ Spots  Fit Room Garden Beauty Pet  Party zone Sky Lounge Green Roof Top  Business Center Toddler Room Kids Playground  Social Deck El apartamento cuenta con un área total de 103 m2 de construcción, de 2 o 3 habitaciones, 2 parqueos tipo tándem, 2 baños completos, balcón",Apartamento en zona 13 en Venta ,Venta,"USD155,150",Apartamentos
"Detalles de Apartamento en Renta y Venta en zona 16 NATUR Premium   Natur Premium edificio exclusivo de solo 6 apartamentos en total, 1 apartamento por nivel en un entorno ecológico dentro del sector con mayor plusvalía, cercano a Cayalá. El edificio cuenta con garita de seguridad, sky loung, gimnasio, parqueo de visitas, ascensor portero de seguridad 24 horas y permiten mascotas. El apartamento cuenta con acceso privado desde Elevador, hall de entrada: 3 dormitorios ( Máster completo + 2 dormitorios con baño compartido) y baño de visitas Sala, comedor, cocina con granito y península Área de Lavandería y habitación de servicio Terraza española 2 parqueos Acabados premium 190 Metros cuadrados de apartamento",Apartamento en Renta y Venta en zona 16 NATUR Premium,Venta y Renta,"USD300,000",Apartamentos
"Detalles de Local comercial en Renta en zona 6 sobre la 15 avenida   Local Comercial de 20 mt2 con baño, en alquiler disponible, el local es nuevo y con acabados, tiene iluminación natural, es de esquina ubicado sobre la 15 avenida en dirección a la Calle Martí. ideal para negocios de barrio como tiendas de conveniencia, venta de comida, piñatería, lavandería, farmacia, entro otros. La renta incluye impuestos y agua,",Local comercial en Renta en zona 6 sobre la 15 avenida,Renta,"Q2,500",Locales comerciales
"Detalles de Apartamento en Shift Cayala Zona 16   Moderno apartamento en venta en Shift Cayala zona 16 Ciudad de Guatemala. A pocos pasos de la emblemática Ciudad Cayala donde encontrara cines, gimnasios, restaurantes, bancos, hoteles, areas de esparcimiento, areas verdes, iglesias y todo lo necesario para tener una vida tranquila y accesible. El edificio donde se encuentra cuenta con 2 piscinas, salon eventos, areas verdes, area Coworking, lobby, areas reuniones, terrazas, parqueo de visitas. El apartamento cuenta con sala con amplio balcon, comedor, cocina moderna, lavanderia, baño, 1 habitación con amplio walkin closet. Incluido: Linea blanca, mobiliario, lamparas, cortinas, menaje completo",Apartamento en Shift Cayala Zona 16,Venta,"Q1,060,000",Apartamentos
"Detalles de  Casa ideal oficina en renta zona 13, Av Las Amer.   Casa ideal para oficinas en renta en zona 13, en Avenida Las Américas  Casa distribuida en dos niveles  Cuenta con 10 ambientes en total, 500 mtr2 de construcción,  se encuentra completamente remodelada, 6 baños, además tiene 6 parqueos internos y 6 parqueos externos Casa completamente iluminada y amplia."," Casa ideal oficina en renta zona 13, Av Las Amer.",Renta,"USD3,000",Casas
"Detalles de Bodegas en Parque Las Tunas Internaranjo Empresarial   Renta bodega moderna área Mixco zona 4 Zona Industrial, Área de Mixco zona 4.  Interconexión Naranjo, San Nicolás, acceso por el Periférico o Calzada San Juan. Nuevo concepto de bodegas, combina servicios de oficinas y bodegas.  Brinda comodidad e innovación en sus arreas, alto nivel de seguridad.  Se ha pensado no solo en la practicidad sino también en la salubridad y bienestar de los colaboradores de todo nivel.   Cuenta con arreas de recreación e higiene, salas de reuniones, parqueo para visitas, área social, cafetería, sala de reuniones. Doble garita de acceso, 109 parqueos de visita, 160 parqueos para motos, circuitos cerrados de cámara de seguridad, muros perimetrales, elevadores del área de parqueo hacia instalaciones, energía 110 y 220, cafetería.       La bodega Cuenta con 6 metros de altura para almacenaje, pueden maniobrar contenedores de 40 pies, acabados de primera, ductos  para instalaciones de internet y cámaras, cuarto de basura, área administrativa.  Se utilizara el área de bodega solo para el resguardo de materiales, no se pueden utilizar las oficinas con este fin.   Las áreas se utilizaran solo con este fin, no se permiten actividades ajenas al almacenaje, no se pueden almacenar productos corrosivos o que contaminen el medio ambiente.   No entidad gubernamental.   Se alquila a empresas que tengan un mínimo de tres años de existir, contrato por 1 año. El inquilino absorbe costo de contrato. Indispensable que el inquilino lea y conozca reglamento de convivencia. NO INCLUYE RACKS NI ESTANTES",Bodegas en Parque Las Tunas Internaranjo Empresarial,Renta,"USD1,736",Bodegas/Naves industriales
"Detalles de Oficina en renta en ZONA PRADERA zona 10   CityMax Renta oficina en zona 10 Guatemala Cuenta con 78.58mts,  esta  oficina cuenta con área de recepción y un solo ambiente amplio, 1 parqueo, 1. Baño, con excelente vista e iluminación natural, accesos biométrico (puerta electrónica) alfombra nueva Empresarial cuenta con seguridad 24 horas CC, Salón social, área comercial con restaurantes reconocidos, amplio parqueo para visitas. Acceso a GYM, paradas de transporte público.  El alquiler ya cuenta con el mantenimiento incluido",Oficina en renta en ZONA PRADERA zona 10,Renta,"USD1,000",Oficinas
"Detalles de TORRE 360 VENDO APARTAMENTO CON PERGOLA GRANDE   Vendo lindo apartamento en super ubicación en Torre 360 zona 15, cuenta con una pérgola espectacular y es cuidado con mucho cariño!  Espacio: 100 mts de apartamento + 31 mts de pérgola/balcón + bodega + 2 parqueos.  Apartamento con sala-comedor, cocina, lavandería, 2.5 baños, 3 habitaciones, pérgola con espacio para comedor de 8 personas y sala exterior. Excelente vista. Lavandería y cocina remodeladas, Equipado con línea blanca: estufa, microondas / extractor, refrigeradora, lavadora de platos, lavadora y secadora de ropa.  Los dos parqueos son paralelos, bodega con estanterías, lámparas de interior y exterior, comedor de exterior para ocho personas, macetas para plantas para pérgola, cortinas de interior y exterior. Edificio de 19 niveles, super bien ubicado, cuenta con  Business Center,   un gimnasio y un skylounge con vistas inspiradoras, También ofrece un jardín con área de juegos. Precio más impuestos",TORRE 360 VENDO APARTAMENTO CON PERGOLA GRANDE,Venta,"USD225,000",Apartamentos
"Detalles de Apartamento en Venta Zona 12 por Plaza Madero   El Proyecto de Apartamentos frente a plaza maderoubicado en un sector de mucha plusvalía, cerca de  centros comerciales,centros educativos, accesos para avenida Petapa y/o Atanasio, trasporte públicoy privado.  13 niveles de vivienda, 6 Sótanos para parqueos deresidentes, visitantes, motocicletas y bicicletas. Los apartamentos cuentas con finos y modernos  acabados. - 1  Habitaciones - 1 baño  - Sala  - Comedor - Cocina  - Lavandería - Jardin - 1 Parqueo Moto y 1 Carro Datos adicionales:   Altura de techo a piso 2.40 mts  Paredes de tabla yeso   Puerta PVC  Zócalo de PVC  Piso cerámico      Amenidades :      Área de deportes  Parque infantil  Caminamiento  Pérgola Churrasquera  Salón Social   Área de teletrabajo  Gimnasio  Spa de Mascotas     Garita de control con seguridad  Acceso controlado de visitas  Sistema de identificación  Circuito cerrado con cámaras de seguridad  Reconocimiento facial     Fecha estimada de entrega ultimo trimestre 2023 Reserva de Q.3.500. Enganche Fraccionado de Q. 64,827. Cuota Mensual de Q.5,686.87 Ingresos Estimados de Q.17,000.",Apartamento en Venta Zona 12 por Plaza Madero,Venta,"Q656,558",Apartamentos
"Detalles de Apartamento en Venta Zona 12 por Plaza Madero   El Proyecto de Apartamentos frente a plaza maderoubicado en un sector de mucha plusvalía, cerca de  centros comerciales,centros educativos, accesos para avenida Petapa y/o Atanasio, trasporte públicoy privado.  13 niveles de vivienda, 6 Sótanos para parqueos deresidentes, visitantes, motocicletas y bicicletas. Los apartamentos cuentas con finos y modernos  acabados. - 2  Habitaciones - 2. baños  - Sala  - Comedor - Cocina  - Lavandería - 2 Balcón - 2 Parqueos car lift Datos adicionales:   Altura de techo a piso 2.40 mts  Paredes de tabla yeso   Puerta PVC  Zócalo de PVC  Piso cerámico      Amenidades :      Área de deportes  Parque infantil  Caminamiento  Pérgola Churrasquera  Salón Social   Área de teletrabajo  Gimnasio  Spa de Mascotas     Garita de control con seguridad  Acceso controlado de visitas  Sistema de identificación  Circuito cerrado con cámaras de seguridad  Reconocimiento facial  Fecha estimada de entrega ultimo trimestre 2023 Reserva de Q.3,500. Enganche de Q.83,194. Ingresos estimados de Q.23,000",Apartamento en Venta Zona 12 por Plaza Madero,Venta,"Q840,327",Apartamentos
"Detalles de Apartamento en Venta Zona 12 por Plaza Madero   El Proyecto de Apartamentos frente a plaza maderoubicado en un sector de mucha plusvalía, cerca de  centros comerciales,centros educativos, accesos para avenida Petapa y/o Atanasio, trasporte públicoy privado.  13 niveles de vivienda, 6 Sótanos para parqueos de residentes,visitantes, motocicletas y bicicletas. Los apartamentos cuentas con finos y modernos  acabados. - 1  Habitaciones - 1 baños  - Sala  - Comedor - Cocina  - Lavandería - 1 Parqueo Carro  - 1 Parqueo Motocicleta Datos adicionales:   Altura de techo a piso 2.40 mts  Paredes de tabla yeso   Puerta PVC  Zócalo de PVC  Piso cerámico      Amenidades :      Área de deportes  Parque infantil  Caminamiento  Pérgola Churrasquera  Salón Social   Área de teletrabajo  Gimnasio  Spa de Mascotas     Garita de control con seguridad  Acceso controlado de visitas  Sistema de identificación  Circuito cerrado con cámaras de seguridad  Reconocimiento facial  Fecha estimada de entrega ultimo trimestre 2023 Reserva: Q.3,350 Enganche Fraccionado desde : Q.57,562. Cuota Mensual aprox. : Q.5,049.50. Ingresos Estimados de Q.16,000",Apartamento en Venta Zona 12 por Plaza Madero,Venta,"Q583,902",Apartamentos
