description,name,operation,price,type
"Detalles de TERRENO EN VENTA EN ZONA 14 EN SECTOR LA VILLA ZONA 14   El terreno esta ubicado en un sector de mucha plusvalía, zona tranquila, poca circulación de carros, ideal para familias que desean estar en un lugar tranquilo. En los alrededores se encuentran muchos proyectos de edificios, a pocos metros esta el club delfines, un club exclusivo con muchas actividades deportivas para toda la familia. El terreno mide 98.20 metros totales.",TERRENO EN VENTA EN ZONA 14 EN SECTOR LA VILLA ZONA 14,Venta,"USD65,000",Terrenos
"Detalles de Apartamento en Venta con Jardín en Zona 15 en Planos   Apartamento en Venta en Zona 15 Edificio nuevo en Construcción, cuenta con un área de 126 m2 solo de apartamento + 74 m2 de Jardín/terraza + 26 m2 de área de parqueo + habitación principal con walk in closet, baño completo y balcón + 2 habitaciones secundarias con closet y baño compartido + baño de visitas + sala + comedor + cocina + balcón.  Edificio de Apartamentos que tendrá 20 niveles de construcción, Piscina climatizada Gym Bistro Lounge CoWorking Terraza Jardin Kids Room Playground Bussines center BBQ Lounge Social Lounge Planta Eléctrica Full Pozo propio 20 parqueos visitas Precio de Venta mas Impuesto Reserva con USD5,000.00 Enganche del 20% Cuotas a 20 Años US$1062 Parqueos Extras desde USD$17,000.00",Apartamento en Venta con Jardín en Zona 15 en Planos,Venta,"USD395,500",Apartamentos
"Detalles de Apartamento en Zona 15 en Alquiler Vista Hermosa   Apartamento en Renta en la Zona 15, cuenta con 140 m2 + 25 m2 de parqueos, habitación principal con balcón, walk in closet y baño completo, habitación secundaria con closet y baño completo, sala, comedor ambos con balcón amplio, cocina con línea blanca, área de espacio para despensa, habitación de servicio con baño completo, baño de visitas, cuenta con una bodega. Edificio con 12 niveles de construcción, cercano al boulevard vista hermosa, cuenta con salón social, gimnasio, área para niños, sauna.",Apartamento en Zona 15 en Alquiler Vista Hermosa,Renta,"USD1,100",Apartamentos
"Detalles de Venta o Renta de Bodega Industrial km 72 Ruta Pacífico   Renta de bodegas industriales incluyen beneficiosfiscales (ZONA FRANCA), estas bodegas están ubicadas en  km 72Ruta al Pacífico Escuintla.  Esta bodega cuenta con 3,000 mt2 Altura: 12mt al hombro,14mt al centro.  Instalación EléctricaBanco de Trasformación  Opción de venta: $700 el mt2 más impuesto.  Opción de renta $4 el mt2 mas impuesto     AMENIDADES Y VENTAJAS DEL COMPLEJO:  * Beneficios fiscales  * Certeza Jurídica bajo el decreto 22-73  * Garita vehicular con sala de recreación para lospilotos (Truck Stop)  * Plaza Comercial en su interior  * Complejo de apartamentos para rentar allí mismo  * Gasolinera Texaco adentro y planta de concreto  * Estación de bomberos  * Salón de usos múltiples  * Clínicas Médicas  * Oficinas de SAT   * Helipuerto  * Zona financiera  * Zona de reforestación  * Centros Educativos y Guardería",Venta o Renta de Bodega Industrial km 72 Ruta Pacífico,Venta y Renta,"USD8,400,000",Bodegas/Naves industriales
"Detalles de Apartamento en Alquiler en Oakland Villas zona 10 Guate   Alquiler amplio apartamento en  Oakland Villas, Zona 10 de Guatemal a, el condominio cuenta con todas las amenidades, amplias área verdes, piscina, Jacuzzi, área de juegos de niños, gimnasio, sauna, salón social, área para parrilladas, parqueo de visitas, cerca de la diagonal 6 y de Oakland mall.   Cuenta con baño de visitas, 2 salas, comedor, balcón, amplia cocina con alacena, área de lavado, habitación de servicio con su baño.   habitación principal con walk in closet y baño propio.   Dos habitaciones adicionales que comparten un baño, una con closet y otra con walk in closet.   3 amplios parqueos y una bodega con baño completo que bien puede ser habitación para piloto o seguridad.    232 metros cuadrados solo de apartamento mas los 3 parqueos mas la bodega La renta incluye el mantenimiento. Más IMP",Apartamento en Alquiler en Oakland Villas zona 10 Guate,Renta,"USD2,000",Apartamentos
"Detalles de Terreno en venta en Parque Industrial de Escuintla   TERRENOS INDUSTRIALES EN VENTA EN Parque Industrial Autopista Puerto Quetzal en Escuintla Guatemala, con facilidad de acceso y alta afluencia comercial.  Terreno de 19,535Mts equivalente a 27,957.42 Varas y con un área de construcción para 11,198Mts. El Proyecto contara con:  Acceso para tubería de graneles líquidos Servicio de trámites de desaduanaje para exportación e importación Servicio de seguridad 24 horas y CCTV  Certificación LEED MasterSite Internet con fibra óptica  Alquiler de montacargas, pallets y racks Red contra incendios  Energía competitiva Servicio de báscula  Agua abundante Zona de Desarrollo Económico Especial Público, es un área geográficamente definida, extra aduanal, para el desarrollo de bienes y servicios industriales o actividades comerciales, con tarifas especiales, régimen aduanero temporal y comercio exterior, autorizadas por ZOLIC.",Terreno en venta en Parque Industrial de Escuintla,Venta,"USD1,817,340",Terrenos
"Detalles de Terreno en Zona Industrial en VENTA Puerto Quetzal   Terreno en venta en Zona Industrial con un área de 20,044 m2 de terreno, equivalente a 28,687.56 v2 y área construible sugerido por 10,783.77 m2, ubicado en una zona industrial del sector y con altos estándares comerciales. Zona de Desarrollo Económico Especial Público, es un área geográficamente definida, extra aduanal, para el desarrollo de bienes y servicios industriales o actividades comerciales, con tarifas especiales, régimen aduanero temporal y comercio exterior, autorizadas por ZOLIC. el proyecto contara con:  Acceso para tubería de graneles líquidos Servicio de trámites de desaduanaje para exportación e importación Servicio de seguridad 24 horas y CCTV  Certificación LEED MasterSite Internet con fibra óptica  Alquiler de montacargas, pallets y racks Red contra incendios  Energía competitiva Servicio de báscula  Agua abundante Precio de Venta mas impuesto + gastos de escrituración, honorarios legales y creación de usuario",Terreno en Zona Industrial en VENTA Puerto Quetzal,Venta,"USD1,864,691",Terrenos
"Detalles de Venta Terrenos En Parque Industrial Escuintla   Proyecto Industrial de Terrenos y bodegas en venta en Escuintla, a pocos kilómetros del puerto quetzal, altos estándares comerciales así como Zona de Desarrollo Económico Especial Público, es un área geográficamente definida, extra aduanal, para el desarrollo de bienes y servicios industriales o actividades comerciales, con tarifas especiales, régimen aduanero temporal y comercio exterior, autorizadas por ZOLIC. Acceso para tubería de graneles líquidos Servicio de trámites de desaduanaje para exportación e importación Servicio de seguridad 24 horas y CCTV  Certificación LEED MasterSite Internet con fibra óptica  Alquiler de montacargas, pallets y racks Red contra incendios  Energía competitiva Servicio de báscula  Agua abundante Terreno con un área de 55,717.76 v2 o su equivalente a 38,930 m2",Venta Terrenos En Parque Industrial Escuintla,Venta,"USD3,621,654",Terrenos
"Detalles de Finca en venta en San Lucas Sacatepéquez   Fincaen venta ubicada en San Lucas Sacatepéquez   La Finca en venta   Cuentacon 5,920.7973  mts2 de terreno.  Construcción de casa  65.70 m2  +16.20 de bodega unida a la residencia. El área total  construida es de 121m2 Finca en venta en San Lucas, cuenta con  Topografía: semi plana omoderadamente inclinad a,  Cuentacon muro perimetral de block, Accesos con calles asfaltadas, alumbradopúblico, drenaje para aguas pluviales y conexión para agua potable municipal,redes de energía eléctrica. Se localiza Céntrico con accesos a Centro Comercial,comercios pequeños y medianos, abarroterías, colegios privados y escuelas públicas,restaurantes, centro de eventos y farmacias.",Finca en venta en San Lucas Sacatepéquez,Venta,"Q4,800,000",Fincas
"Detalles de CASA EN VENTA EN FRAIJANES KM. 22.5   La casa en venta se encuentra en un sector de creciente plusvalía y muy cerca de centros comerciales, colegios, universidades, centros de diversión, hospitales y todo lo que necesita usted y su familia en la vida diaria. considerando el futuro desarrollo del sector existe un paso a desnivel que permite un acceso directo y seguro a Portal del Bosque. diseño moderno, con 4 estacionamientos construida en lote de 13.40 de frente x 19.30 de fondo, se distribuye de la siguiente manera: NIVEL 1 Jardín Sala principal Comedor Cocina Lavandería Baño de visitas 2 estacionamientos individuales NIVEL 2 1 Dormitorio principal con walkin closet y baño privado 2 Dormitorios secundarios con closet y baño compartido Sala familiar",CASA EN VENTA EN FRAIJANES KM. 22.5,Venta,"Q1,750,821",Casas
"Detalles de Apartamentos en venta zona 16 Ciudad Cayala    Apartamento en Construcción en Zona 16 de Cayala con un área de 38 m2 hasta 43.94 m2 de construcción, cuenta con una habitación con closet, sala, comedor, cocina, lavandería, servicio sanitario, balcón.  Este proyecto contara con 3 torres de uso mixto y 5 niveles por cada torre, oficinas comerciales, tiendas de conveniencias, amplios espacios de área verde. como área de juegos para niños, parqueo de visitas, seguridad las 24 hrs.  RESERVA CON $1,500.00 25% DURANTE LA CONSTRUCCION  Precio de Venta con Impuesto.",Apartamentos en venta zona 16 Ciudad Cayala ,Venta,"USD123,700",Apartamentos
"Detalles de Apartamento en Alquiler en Zona 5 San Pedrito   Apartamento en Alquiler en la Zona 5, cuenta con 94 m2 de construcción + 3 habitaciones + 2 baños (con lámparas y espejos con iluminación) + sala + comedor + cocina amplia con isla + Bodega + 2 parqueos + área de lavandería, la habitación principal cuenta con walk in closet + 2 balcones con iluminación vintage + todas las ventanas con cortinas, habitación principal con cortinas motorizada, calentador de agua, torre de lavado, microondas, refrigeradora, horno, plancha de 4 hornillas, extractor, dishwasher, triturador. El edificio cuenta con Seguridad, parqueo para visitas, lobby/recepción, gimnasio, área verde, área para niños, juegos para niños, área social, pozo propio.",Apartamento en Alquiler en Zona 5 San Pedrito,Renta,"USD1,100",Apartamentos
"Detalles de Bodega en Alquiler en Zona 10 Cerca Centro Medico   Bodega con frente comercial en Alquiler en Zona 10 Cerca Centro Medico, la bodega es ideal para supermercado, tienda de conveniencia, show room, centro de atención, área para almacenaje entre tantos, con excelente ubicación. La bodega esta a pocos metros del centro medico zona 10, Boulevard Vista Hermosa y 6 Avenida Zona 10 en Guatemala, cuenta con 7.7Mts de Frente x 20Mts de fondo, cuenta con una altura a hombro de 7Mts y al centro de 9Mts. La bodega cuenta con instalación de Agua, se debe instalar baño.",Bodega en Alquiler en Zona 10 Cerca Centro Medico,Renta,"Q9,500",Bodegas/Naves industriales
"Detalles de Casa en Venta 245 metros zona 4 de Mixco con garita   Casa en venta en Zona de fácil acceso con servicios varios, cerca de centros Comerciales, bancos, colegios, paradas de bus, ingreso por San Juan, Periferico y el Naranjo. Transporte publico a toda hora.   Casa dentro de garita, el residencial tiene garita las 24 horas del día.  Pocas casas, Condominio sumamente seguro y tranquilo. La casa esta lista para mudarse, no necesita reparaciones, ambientes amplios y buenas terminaciones, muy bien iluminada con puertas de madera. Pequeño patio al fondo, con puertas de vidrio.  Closet de pura madera.  1er nivel, parqueos, sala principal, comedor, area de servicios con dormitorio y baño.  Lavandería con patio de tender. 2do nivel, sala familiar, 2 dormitorios secundarios que comparten baño y el principal con baño privado.  Todas las áreas grandes, cómodas y muy bien iluminadas.  La terraza en el 2do nivel es amplia, se puede hacer una pergola. Mantenimiento incluye solo garita de seguridad Q800.00  Se paga por aparte extracción de basura y servicios. Condominio seguro, mantenimiento sobre solo Garita de seguridad, Agua, luz y basura por aparte.  Garita las 24 horas",Casa en Venta 245 metros zona 4 de Mixco con garita,Venta,"USD185,000",Casas
"Detalles de Casa en Venta en Condominio en Km 18.5 CES   Amplia Casa en venta en Kilómetro 18.5 Carretera a El Salvador Condominio ubicado a 100 metros de la carretera principal.  Cercano a Centros Comerciales, Supermercados, Restaurantes y tiendas de conveniencia, Colegios de Prestigio, Hospitales y vías de acceso. El Condominio cuenta con cisterna que abastece de aga a las residencias, garita de seguridad 24/7.  La casa de 2 niveles, cuenta con 583.94 Mts2 de terreno, con amplias áres verdes, con muy buena iluminación y ventilación. En el primer nivel cuenta con parqueo para 4 vehículos, vestíbulo de ingreso, baño de visitas, estudio, sala principal con chimenea, comedor amplio con acceso al jardín y prgola, área de cocina con desayunador, gabinetes de madera, alasena, lavandería, cuarto de servicio con baño completo, patio de servicio En el segundo nivel cuenta con dormitorio principal walk in closet , baño completo, 3 dormitorios secundarios con baño y sala familiar, finos acabados en madera en toda la casa.",Casa en Venta en Condominio en Km 18.5 CES,Venta,"USD350,000",Casas
"Detalles de Venta o Renta de apartamento en cañada 16   El edificio esta ubicado en una zona de fácil acceso, en los alrededores se encuentran las universidades y colegios de mayor prestigio de Guatemala, ideal para las familias que quieran vivir en un entorno lleno de arboles, con aire fresco y cerca de colegios.  El apartamento de 72Mts + 25Mts. Cuenta con 3 habitaciones, sala-comedor, 1 baño, 2 parqueos, incluye linea blanca Amenidades del edificio - Gimnasio -juego para niños - Áreas sociales -Churrasqueras -Áreas Verdes",Venta o Renta de apartamento en cañada 16,Venta y Renta,"USD130,000",Apartamentos
"Detalles de Casa en venta en Carretera a el Salvador en Planos    Venta de Casa en Condominio Exclusivo de Carretera a el Salvador, el proyecto contara con:  Garita de control Amplias calles de concreto y adoquín estilo europeo Red de agua potable Pozo propio Cisterna Red de drenajes pluviales y aguas negras Planta de tratamiento Red de energía eléctrica Alumbrado de calles y áreas comunes será con lámparas tipo led y postes de concreto. Ducto subterráneo para cable e intercomunicador. La Casa tendrá dos niveles de construcción distribuidos así:  NIVEL UNO: Jardín, Sala principal, comedor, cocina, Lavandería, Baño de visitas, baño de servicio. NIVEL DOS: 1 dormitorio principal con baño completo y walk in closet, 2 dormitorios secundarios con closet y baño compartido, sala familiar.",Casa en venta en Carretera a el Salvador en Planos ,Venta,"Q1,512,724",Casas
"Detalles de Tu apartamento en Renta está en zona 15 Guatemala   Renta de apartamento Nuevo en zona 15 Guatemala, muy cerca de Metro15, cerca de parques, areas verdes, areas comerciales, gimnasios, entre otros. El edificio cuenta con Salón social. Jardín para mascotas, área de juegos para niños, lounge barbecue y firepit, wifi en todas las áreas comunes. Gimnasio, parqueo para visitas y baños de servicio en cada nivel del edificio.  El apartamento de 77.84mts mas 2 parqueos 25mts = 102.84mts2 con  Cocina  equipada  con electrodomésticos (estufa, refrigeradora, estufa y horno microondas)  lavandería equipada  (lavadora y secadora) iluminación led, 2 habitaciones con walk in closet y baño cada una, sala comedor, 2 parqueos Incluye el mantenimiento. Más IMP",Tu apartamento en Renta está en zona 15 Guatemala,Renta,"USD1,000",Apartamentos
"Detalles de VENTA Casa en Portal del bosque Carretera a el Salvador   Casa en Venta en Construcción con 137 m2 + 209 v2 de área de terreno 7.60 x 18.35,  + 2 NIVELES DE CONSTRUCCION:  NIVEL UNO:   Jardín Sala principal Comedor Cocina Lavandería Baño de visitas 2 estacionamientos individuales NIVEL 2 1 Dormitorio principal con walking closet y baño privado 2 Dormitorios secundarios con closet y baño compartido Sala familiar El proyecto contara con:  Garita de control Amplias calles de concreto y adoquín estilo europeo Red de agua potable Pozo propio Cisterna Red de drenajes pluviales y aguas negras Planta de tratamiento Red de energía eléctrica Alumbrado de calles y áreas comunes será con lámparas tipo led y postes de concreto. Ducto subterráneo para cable e intercomunicador.",VENTA Casa en Portal del bosque Carretera a el Salvador,Venta,"Q1,435,952",Casas
"Detalles de Apartamento en Venta en Zona 15 en Planos   Proyecto de Apartamentos en Venta en la Zona 15 Vista Hermosa II en Planos. El apartamento en venta contara con 57 m2 de construcción + 2 parqueos 26Mts para un total de 83Mts. Distribuidos en habitación principal con closet + habitación secundaria y closet + sala + comedor + cocina + balcón + área de lavandería + 1 Baño completo El Proyecto contara con:  20 niveles de construcción 6 Sótanos 2 Ascensores 84 Apartamentos Amenidades Piscina climatizada Gym Bistro Lounge CoWorking Terraza Jardin Kids Room Playground Bussines center BBQ Lounge Social Lounge Planta Eléctrica Full Pozo propio 20 parqueos visitas Precio de Venta mas Impuesto  Reserva con USD5,000.00 Enganche del 20% Cuotas a 20 Años US$1062 Parqueos Extras desde USD$17,000.00",Apartamento en Venta en Zona 15 en Planos,Venta,"USD157,700",Apartamentos
"Detalles de Final Hincapié Renta apartamento zona 13   Excelente ubicación, cercanía con zona 13, zona 14.  Transporte cercano a apartamento, cercanía con la Vas. Se encuentra rodeado por varios servicios, supermercados, gasolinera, colegios, bancos, áreas medicas, restaurantes, talleres, librerías. A  pocos minutos de centros comerciales de zona 14.  A 2 minutos de ciclovía.   10 minutos de aereopueto. El área tiene varios accesos y salidas. Entrada por la avenida Hincapié, 15 avenida y avenida Las Américas. El condominio es sumamente seguro, tiene áreas verdes, parqueo para visitas, juegos infantiles,  churrasquera y caminamientos agradables.  Condominio sumamente tranquilo. Muy bien iluminado, no se escucha el trafico de bajada de Hincapie, tiene sala, comedor, 3 habitaciones, escritorio, 1 baño compartido para dos habitaciones y dormitorio  principal con tina.  Todos los dormitorios tienen closet,  Se encuentra en el 3er nivel.  Incluye agua y mantenimiento en la renta.  Se proporcionan 2 tarjetas de acceso. La cuota de mantenimiento se encuentra incluida en la Renta.   Parqueos frente a torre de Apartamentos.   No incluye linea blanca.",Final Hincapié Renta apartamento zona 13,Renta,"Q5,500",Apartamentos
"Detalles de Venta en Planos Apartamento en Zona 15 Vista Hermosa II   El proyecto Residencial de Apartamentos Contara con: 20 niveles, 6 Sotanos, 2 Ascensores, 84 Apartamentos Amenidades: Piscina climatizada, Gym, Bistro Lounge, CoWorking, Terraza Jardin, Kids Room, Playground, Bussines center, BBQ Lounge, Social Lounge Servicios: Planta Electrica Full, Pozo propio, 20 parqueos visitas En Venta Apartamento en Planos con 83 m2 de Construcción + 26 m2 de 2 parqueos para un total de 109 m2 de construcción + Dormitorio principal con baño y closet y balcón + dos habitaciones con closet y con baño completo compartido + sala + comedor + cocina + área de lavandería y baño de visitas + balcón en sala.  Precio de venta mas impuestos Reserva con USD$.5,000.00 Enganche del 20% Parqueos Extras por USD$.17,000.00 Cuotas a 20 Años US$1322",Venta en Planos Apartamento en Zona 15 Vista Hermosa II,Venta,"USD196,200",Apartamentos
"Detalles de CASA VACACIONAL EN LAGUNA DE AYARZA, SANTA ROSA   Quieres disfrutar del sueño de vivir frente a una laguna?  esta es la oportunidad de adquirir una casa linda vacacional o vivienda permanente frente a una de las lagunas más hermosas de Guatemala, ubicada en el departamento de Santa Rosa, la famosa, mística y encantada Laguna de Ayarza, La distancia de la ciudad de Guatemala a la  Laguna de Ayarza  es aproximadamente de 95 kilómetros, que se recorren en un tiempo promedio de 2 horas.Es un destino poco explotado turísticamente, por lo que se mantiene virgen y apto para el auténtico ecoturismo. La villa en venta cuenta con terreno de 600 varas cuadradas, casa con 150 metros construidos en un nivel, de dos habitaciones, un baño, 1 mezanine, 1 bodega, Completamente amueblada Incluye: 4 kayaks La casa está frente a la Laguna y cuenta con acceso en carro (terracería)  y por lancha. Tiene Agua y Luz","CASA VACACIONAL EN LAGUNA DE AYARZA, SANTA ROSA",Venta,"Q860,000",Casas
"Detalles de Apartamento en Alquiler Edificio Veinti4 Zona 10   Apartamento en Alquiler en La zona 10 a un costado de Zona Pradera, boulevard los proceres, centro comercial pradera zona 10 y rambla 10, con hermosas vistas hacia zona 15, zona 10 y boulevard los proceres.  Edificio con seguridad las 24 hrs + acceso por medio de huella digital + gimnasio + piscina + área de lounge con acceso a WIFI + business center con accesos a WIFI + salones sociales parea eventos + área de jardín + área de buzones para correspondencias. Apartamento con 130 m2 de construcción + habitación principal con walk in closet y baño + dos habitaciones secundarias con baño compartido + área de Lavandería + Calentador tipo titan + sala + comedor + cocina (INCLUYE LINEA BLANCA + LAVADORA DE PLATOS + TRITURADOR Y EXTRACTOR) + Alacena + closet de blancos + 2 balcones + 1 luz emergente cuando no haya energía eléctrica ambos ubicados en el área de cocina.",Apartamento en Alquiler Edificio Veinti4 Zona 10,Renta,"USD1,500",Apartamentos
"Detalles de Hermosa y Amplia Casa en Renta en La Montaña Zona 16   Alquiler amplia y hermosa casa en Zona 16 La Montaña, cercana a Centros Comerciales, Restaurantes, agencias bancarias, cines y de la Embajada Americana y Cayalá. La casa se ubica dentro de residencial con garita de seguridad, en el primer nivel cuenta con garaje para 4 vehículos con portón eléctrico, porche en la entrada, vestíbulo, baño de visitas, sala de visitas, comedor de visitas, cocina con sus gabinetes de madera, lavaplatos, un pantry con vista al jardín, lavandería con sus clóset, lavadora y secadora, cuarto de servicio con su baño completo, amplio jardín con fuente, con bellas vistas a la ciudad, churrasquera y un baño completo para el área exterior. En el segundo nivel, cuenta con 4 dormitorios, el dormitorio principal con baño completo, jacuzzi, caja de seguridad y walk in closet, un segundo dormitorio con baño completo, y 2 dormitorios con closet que comparten un baño, un clóset para blancos y una terraza. La casa cuenta con calentador general de agua, cisterna, con hermosas vistas a la ciudad, muy buena ventilación e Iluminación. La renta incluye el pago del mantenimiento.",Hermosa y Amplia Casa en Renta en La Montaña Zona 16,Renta,"USD1,800",Casas
"Detalles de Apartamento Nuevo en Alquiler Zona 15   Apartamento Nuevo de 2-3 habitaciones en Alquiler Zona 15, en un entorno enviadiable, con doble garita de seguridad, calle privada con acceso restingido, a pocos pasos metros del Boulevar Vista Hermosa, Centros comerciales, clinicas medicas, centros de recreacion y el corazon de la Ciudad de Guatemala. El edificio cuenta con parqueo de visitas, lobby, salas de espera, bussines center, coworking, area lounge, gimnasio, area niños techada, cinema, terraza lounge, area de parrilladas, area de mascotas, firepit, 2 ascensores, seguridad, planta electrica. El apartamento originalmente era de 3 habitaciones y se convirtio a 2 dormitorios, tiene 2 baños completos mas el baño de visitas, lavanderia, cocina abierta y equipada, sala grande, comedor amplio, 2 balcones, 2 estacionamientos.",Apartamento Nuevo en Alquiler Zona 15,Renta,"USD1,300",Apartamentos
"Detalles de Casa en Venta Alameda de San Isidro Zona 16   Amplia casa en venta completamente remodelada, acabados de lujo, dentro de Condominio Alameda de San Isidro, zona 16, cercana a centros comerciales, Ciudad Cayalá, hospitales, colegios de prestigios, principales universidades, boulevard Acatan, varios accesos, condominio con áreas verdes, estacionamientos de visita, área para eventos, juegos infantiles, seguridad 24 horas.  Sala Comedor cocina remodelada con gabinetes (opcional linea blanca) y Top de cuarzo. 4 habitaciones, principal con baño y 2 walk-in closet, secundaria con acceso a pérgola y baño, secundarias comparten baño. sala familiar amplia baño de visitas Pérgola doble altura de madera y techo Shingle Iluminada  Acceso a terraza de 3er nivel Parqueo para 4 vehículos  Jardín  Cuota de Mantenimiento incluye: extracción de basura, seguridad, servicio de agua, mantenimiento de áreas comunes.  Remodelaciones: piso de porcelanato, cocina de Cocinas Exclusivas, fachaleta,",Casa en Venta Alameda de San Isidro Zona 16,Venta,"USD375,000",Casas
